Id,Date_Created_Utc,Score,Parent_id,Body,Link
gtppu50,1617818378,3,t3_mm72xd,Give it time,/r/Conservative/comments/mm72xd/spirit_airlines_installs_ejection_seats_for/gtppu50/
gtppxjl,1617818418,1,t1_gtpi0f8,Most republicans wont even do this stuff. And most of the time it doesn't do anything anyways. Getting someone in south dakota to give up diet coke because of mlb moving the all star game out of georgia isnt gunna happen. Trump called for a boycott then had a diet coke on his desk. Its just chatter. Because if u boycott coke then wouldn't u have to boycott every business that does business with coke or in some way coke is getting your dollars.,/r/Conservative/comments/mm6l8h/its_high_time_we_make_woke_corporate_america_feel/gtppxjl/
gtppz37,1617818436,5,t1_gtpns08,Joe's just trying to retain the undead vote!,/r/Conservative/comments/mm6uqu/report_biden_to_take_new_executive_action_on/gtppz37/
gtpq02z,1617818448,-8,t1_gtpovod,Thank you for confirming your cult’s detachment from reality.,/r/Conservative/comments/mm670w/dr_fauci_is_left_stammering_incoherently_after/gtpq02z/
gtpq0o8,1617818455,1,t1_gtplyu8,"Not if they're built by democrats, apparently.",/r/Conservative/comments/mm73aj/biden_to_tear_down_wall_replace_with_more/gtpq0o8/
gtpq4jb,1617818501,2,t3_mm677s,"""Hey guys, let's put these people in old folks homes"" -Andy Cuomo",/r/Conservative/comments/mm677s/blue_new_york_identified_as_top_hot_spot_of_the/gtpq4jb/
gtpq4u7,1617818505,6,t1_gtpoki0,Established companies always like regulation and barriers to entry because it keeps out competitors. There's a reason Zuck was all about regulating social media and wanting to be involved in that. It's cheaper to absorb costs associated with compliance or some extra tax than the lost profits as a result of more agile and innovative competitors.,/r/Conservative/comments/mm6eb2/jeff_bezos_just_endorsed_corporate_tax_hikes/gtpq4u7/
gtpq60b,1617818519,4,t3_mm70pz,There's no vaccine for crazy.,/r/Conservative/comments/mm70pz/this_is_an_invasion_of_my_privacy_joy_behar_is/gtpq60b/
gtpq69p,1617818522,3,t1_gtpoyv2,You might wanna go google ripe there buddy,/r/Conservative/comments/mm6g90/factcheck_colorado_makes_voting_far_easier_than/gtpq69p/
gtpq6kc,1617818525,6,t3_mm7r4f,"Thats right.  When great turdbird hit the scene, she was blabbering about china leading in renewables.  Idiots everywhere cite china's renewables.   They don't exist.  ccp don't work like that.  But sjws cite china against us.  We're too civil.",/r/Conservative/comments/mm7r4f/wokeness_as_a_geopolitical_tool_author_says_china/gtpq6kc/
gtpqa07,1617818566,17,t3_mm70pz,"If it were trump suggesting vaccine passports and mandatory vaccination, this woman would be up in arms about how nobody needs the vaccine. 

She’s a shill.",/r/Conservative/comments/mm70pz/this_is_an_invasion_of_my_privacy_joy_behar_is/gtpqa07/
gtpqap4,1617818574,4,t3_mm6uqu,Thank god. The rampant shootings on live persons by armed spectral apparitions was too damn high.,/r/Conservative/comments/mm6uqu/report_biden_to_take_new_executive_action_on/gtpqap4/
gtpqfhn,1617818631,1,t3_mm72kl,"I agree with McConnell, keep corporate money out of politics. (Unless they are giving him money secretly)",/r/Conservative/comments/mm72kl/google_removes_entire_state_of_georgia_from/gtpqfhn/
gtpqi6u,1617818663,4,t1_gtpmjyq,Written by a stupid liberal.,/r/Conservative/comments/mm6u7q/marjorie_taylor_greene_sees_32m_fundraising/gtpqi6u/
gtpqlbi,1617818701,7,t1_gtpp4hw,Sad but true thus is why I think he's going to get some type of sentence unfortunately,/r/Conservative/comments/mm7dh9/day_7_of_chauvins_trial_was_a_train_wreck_of_a/gtpqlbi/
gtpqnqh,1617818729,4,t1_gtpozw5,0% chance of that happening.,/r/Conservative/comments/mm7dh9/day_7_of_chauvins_trial_was_a_train_wreck_of_a/gtpqnqh/
gtpqp3i,1617818745,3,t1_gtpnwl6,"Which Fraudci are you referencing, January Fauci or May Fauci? Hmmm... even December Fauci's opinion changed then too! What's next from that clown, quadruple masking?",/r/Conservative/comments/mm670w/dr_fauci_is_left_stammering_incoherently_after/gtpqp3i/
gtpqp4y,1617818746,3,t1_gtpi0ez,Law in order is out. Only alleged racial crimes can be prosecuted.,/r/Conservative/comments/mm6nrq/dc_police_chief_prosecuting_teen_who_killed_uber/gtpqp4y/
gtpqt8b,1617818793,14,t1_gtpnxkk,All the defense needs is one person to say not guilty,/r/Conservative/comments/mm7dh9/day_7_of_chauvins_trial_was_a_train_wreck_of_a/gtpqt8b/
gtpr0jl,1617818880,1,t1_gtpphrx,"&gt; The Constitution specifically allows the regulation of firearms

What part of ""shall not be infringed"" was unclear to you?",/r/Conservative/comments/mm6g90/factcheck_colorado_makes_voting_far_easier_than/gtpr0jl/
gtpr19x,1617818888,4,t3_mm6eb2,Barrier to entry. Another guy who starts an online used bookstore in his garage won't be able to become Amazon tomorrow with more barriers in place than Bezos faced.,/r/Conservative/comments/mm6eb2/jeff_bezos_just_endorsed_corporate_tax_hikes/gtpr19x/
gtpr458,1617818922,9,t1_gtpoygo,These riots could be epic if he’s found not guilty.,/r/Conservative/comments/mm7dh9/day_7_of_chauvins_trial_was_a_train_wreck_of_a/gtpr458/
gtpr5d4,1617818937,2,t1_gtpqlbi,Convict a guy or have your neighborhood in flames and possibly car robbed at gunpoint.  I think it’ll work sadly.,/r/Conservative/comments/mm7dh9/day_7_of_chauvins_trial_was_a_train_wreck_of_a/gtpr5d4/
gtpr5j0,1617818939,2,t1_gtpku7t,"Well they control the media and narrative so
I think they will do what they want. The influence they have is too great. Media and big
Tech need to have strict rules based on facts. Ratings be damned. Take the money out of politics its harmful to the country",/r/Conservative/comments/mm6z29/organizer_gets_busted_with_big_time_attempted/gtpr5j0/
gtpr74h,1617818958,7,t3_mm70pz,"Given the fact that most, if not all, of those who do not want to get the vaccine would not consider being near this woman does that make her point moot?",/r/Conservative/comments/mm70pz/this_is_an_invasion_of_my_privacy_joy_behar_is/gtpr74h/
gtpr8l4,1617818975,2,t3_mm70pz,These are all excellent and spot on comments!,/r/Conservative/comments/mm70pz/this_is_an_invasion_of_my_privacy_joy_behar_is/gtpr8l4/
gtprhd2,1617819080,1,t3_mm7r4f,[removed],/r/Conservative/comments/mm7r4f/wokeness_as_a_geopolitical_tool_author_says_china/gtprhd2/
gtprl63,1617819124,3,t1_gtpq02z,"Yep, thanks for showing us just how far from reality the Left really is. Always being fed shit and just blindly accepting it without question. The Left in a nutshell.",/r/Conservative/comments/mm670w/dr_fauci_is_left_stammering_incoherently_after/gtprl63/
gtprmuc,1617819144,1,t3_mm74gz,Should be a short investigation.,/r/Conservative/comments/mm74gz/indiana_ag_to_investigate_amazon_apple_facebook/gtprmuc/
gtprmy8,1617819146,4,t1_gtpmyps,"Yes, what the actual fuck?",/r/Conservative/comments/mm6nrq/dc_police_chief_prosecuting_teen_who_killed_uber/gtprmy8/
gtprqt7,1617819191,1,t3_mm7r4f,[removed],/r/Conservative/comments/mm7r4f/wokeness_as_a_geopolitical_tool_author_says_china/gtprqt7/
gtprtj6,1617819224,2,t1_gtpphrx,ID is free in Georgia all you gotta do is go pick it up. So I don’t know what your argument against the Georgia voting law is based off that information.,/r/Conservative/comments/mm6g90/factcheck_colorado_makes_voting_far_easier_than/gtprtj6/
gtpru24,1617819230,1,t3_mm670w,[removed],/r/Conservative/comments/mm670w/dr_fauci_is_left_stammering_incoherently_after/gtpru24/
gtprwtv,1617819263,1,t1_gtpj86h,[removed],/r/Conservative/comments/mm6nrq/dc_police_chief_prosecuting_teen_who_killed_uber/gtprwtv/
gtprx41,1617819266,4,t1_gtpp66g,"Lol first off I am black. Second off nowhere do I imply stupidity. Your article is questionable at best seeing how Bruce ran unopposed the entire time. Also if you haven’t voted or lived in Metro Georgia please don’t speak on what you don’t know. 

Lines are crazy long here in Georgia. Not to mention the fact people work. People have kids. And most time those kids have to wait with their parents in line to vote. Last time I voted in Georgia it took almost two hours. And I got there early. Now think of all of those people who also got there early, but have obligations like idk... work, kids etc. Even if they got there early and planned things out it’s still not a guarantee that you will get in and out on time. Compare that to what I stated above where the average wait time after closed polls in non white communities is 51 minutes compared to 6 minutes in white communities. That was by design. 

Now let’s add making it illegal to had out water and snacks for people (adult and children) waiting in these long lines in this Georgia heat. 

How about we also limit the drop boxes to polling places only where we can conveniently close at 5PM, where most people get off work. Atlanta traffic is horrible btw. Damn... can’t make it in time to early vote. Which leads to Election Day voting, which leads to the issues I stated above, long ridiculous lines. 

Now let’s add challenging any voters eligibility to vote. Came to the wrong polling place? Disqualified. Wrong district? Disqualified. New address? Disqualified. Signature doesn’t match? Disqualified.

Now let’s sprinkle taking powers away from the SOS if you don’t like the outcome. 

Yeah this bill is really about voter ID. Georgia went blue. GOP is pissed about it. Texas almost went blue. GOP wants to make sure that doesn’t happen again. Cant change their unpopular policies so let’s change the rules huh?",/r/Conservative/comments/mm6g90/factcheck_colorado_makes_voting_far_easier_than/gtprx41/
gtps087,1617819304,1,t1_gtplz85,[removed],/r/Conservative/comments/mm6nrq/dc_police_chief_prosecuting_teen_who_killed_uber/gtps087/
gtps0w2,1617819312,-9,t1_gtpo1ed,"What does this have to do with the former president who tried to politicize a virus he knew was serious?  Give me a break dude, just call out the bullshit instead defending a pedo.",/r/Conservative/comments/mm6iw3/after_throwing_their_pastor_in_jail_for/gtps0w2/
gtps1ly,1617819321,1,t1_gtpje4o,[removed],/r/Conservative/comments/mm6l8h/its_high_time_we_make_woke_corporate_america_feel/gtps1ly/
gtps1nn,1617819321,1,t3_mm6l8h,"Fyi

https://en.m.wikipedia.org/wiki/List_of_Coca-Cola_brands",/r/Conservative/comments/mm6l8h/its_high_time_we_make_woke_corporate_america_feel/gtps1nn/
gtps3l4,1617819344,2,t3_mm70pz,If she wasn't obese she would be less at risk.,/r/Conservative/comments/mm70pz/this_is_an_invasion_of_my_privacy_joy_behar_is/gtps3l4/
gtps3we,1617819348,-1,t1_gtprl63,"Lmao. 
From the one that thinks fauci is a secret Chinese operative.",/r/Conservative/comments/mm670w/dr_fauci_is_left_stammering_incoherently_after/gtps3we/
gtps56q,1617819363,3,t1_gtpp66g,"Electioneering was already illegal, so why is it illegal for me to bring water to my elderly parents who have been waiting in line for hours? 

&gt; Why do you think black people are too stupid to pick up a bottle of water on their way to the poll?

You're neglecting to account for the length of these lines that disproportioning effect inner cities. When we are talking about a 5, 8, or 10 wait to vote in the 70-80 degree weather, it should be expected that most people would need food, water, and/or a bathroom break. By enacting laws that prevents bringing food, water, and holding places in line, this creates an environment that discourages people in inner cities from voting",/r/Conservative/comments/mm6g90/factcheck_colorado_makes_voting_far_easier_than/gtps56q/
gtpsb76,1617819433,2,t3_mm830t,I’m sure the “rapper” more closely reflects the ideals of the Christian faith. Probably a good call. Probably definitely did not get threatened with accusations of racism.,/r/Conservative/comments/mm830t/andy_ngô_speech_canceled_by_christian_conference/gtpsb76/
gtpscpv,1617819451,3,t1_gtps3we,\*knows,/r/Conservative/comments/mm670w/dr_fauci_is_left_stammering_incoherently_after/gtpscpv/
gtpsdpu,1617819463,1,t1_gtppz37,[deleted],/r/Conservative/comments/mm6uqu/report_biden_to_take_new_executive_action_on/gtpsdpu/
gtpsfse,1617819488,4,t3_mm6eb2,Of course this pos supports more taxes on competition that it ensures he doesn't pay through greasing corrupt politicians.,/r/Conservative/comments/mm6eb2/jeff_bezos_just_endorsed_corporate_tax_hikes/gtpsfse/
gtpsh2h,1617819503,19,t3_mm8ayc,My Governor will politely tell the president where he can shove that executive order 😁,/r/Conservative/comments/mm8ayc/bidens_gun_control_executive_orders_are_imminent/gtpsh2h/
gtpsh87,1617819505,3,t3_mm6z29,Biden said antifa isn't real so that has to be the truth.,/r/Conservative/comments/mm6z29/organizer_gets_busted_with_big_time_attempted/gtpsh87/
gtpshkh,1617819509,2,t3_mm7r4f,"I havent this article but believe it. 

There was a Twitter acct recently that was exposed as fake. They were posting anti-trump, woke and pro CCP posts. They were also twitter verified with only 80 followers 🤔",/r/Conservative/comments/mm7r4f/wokeness_as_a_geopolitical_tool_author_says_china/gtpshkh/
gtpsm53,1617819563,10,t3_mm8ayc,"Require purchasers of ghost guns to get background checks?

Just how does this work, everyone who buys billet aluminum or an electric drill or drill bits or something has to get a NICS background check?",/r/Conservative/comments/mm8ayc/bidens_gun_control_executive_orders_are_imminent/gtpsm53/
gtpsnge,1617819578,9,t1_gtps0w2,"Yes you are right the left in no way made any attempts ever of politicizing the virus. The left is not in anyway perpetuating that politicization nor is it attempting to put people against one another based on their views on covid or the vaccine. Nor are they pushing vaccine passes and encouraging those with the vaccine to shame those without it. Nope nothing to see here.

Oh and by the way, where did I defend trump?",/r/Conservative/comments/mm6iw3/after_throwing_their_pastor_in_jail_for/gtpsnge/
gtpsr1w,1617819621,3,t1_gtpo0ns,Bahaha!,/r/Conservative/comments/mm7dh9/day_7_of_chauvins_trial_was_a_train_wreck_of_a/gtpsr1w/
gtpsrgx,1617819626,0,t1_gtprx41,"&gt; Now let’s add challenging any voters eligibility to vote. Came to the wrong polling place? Disqualified. Wrong district? Disqualified. New address? Disqualified. Signature doesn’t match? Disqualified.
  
I coined the term Felix's Law for my observation that as a political discussion grows longer, the probability of a liberal admitting he thinks black people are stupid approaches 1.",/r/Conservative/comments/mm6g90/factcheck_colorado_makes_voting_far_easier_than/gtpsrgx/
gtpsxay,1617819693,5,t1_gtpqa07,"He should just start coming out openly supporting Democrat policies.     

Their heads would explode.        

&gt;""Yes. Hold on, stop talking, let me finish. Vaccine passports are beautiful. It's the best policy everrr! President Biden, he's the best president. A humongous president!""",/r/Conservative/comments/mm70pz/this_is_an_invasion_of_my_privacy_joy_behar_is/gtpsxay/
gtpsy2t,1617819702,1,t1_gtps56q,"If your elderly parents are too stupid to bring a bottle of water and a sandwich, it's probably for the best that they don't vote.",/r/Conservative/comments/mm6g90/factcheck_colorado_makes_voting_far_easier_than/gtpsy2t/
gtpsy3t,1617819703,3,t1_gtpmujc,Him covering up paedophile rapists. https://youtu.be/1Su8kTukkEg,/r/Conservative/comments/mm77ro/donald_trump_denies_matt_gaetz_asked_him_for_a/gtpsy3t/
gtpt12u,1617819738,2,t3_mm6g4m,I don't know Andrew too well. How do you think he'll be as NY governor?,/r/Conservative/comments/mm6g4m/andrew_giuliani_son_of_rudy_giuliani_plans_to/gtpt12u/
gtpt30y,1617819761,-2,t1_gtpr0jl,The government can not ban owning firearms but it can regulate them. Laws regulating firearms have existed just about as long as our nation has existed.,/r/Conservative/comments/mm6g90/factcheck_colorado_makes_voting_far_easier_than/gtpt30y/
gtpt6tz,1617819807,5,t1_gtphyuw,"Yeah that's not what Church is or worship of God, you are totally taking that scripture out of context and don't understand its meaning.  It's meaning is to pray for things that are on your heart in private because its 1) no one's business and 2) direct communication between you and the Father.  

This has NOTHING to do with what's going on right now.  Please educate yourself before you start throwing our scriptures",/r/Conservative/comments/mm6iw3/after_throwing_their_pastor_in_jail_for/gtpt6tz/
gtpt724,1617819809,2,t3_mm6l8h,Conservatives have been passive and defensive for far too long and its never worked. A lot of you are still uncomfortable with the idea of being active and going on the offensive. Get comfortable with being uncomfortable.,/r/Conservative/comments/mm6l8h/its_high_time_we_make_woke_corporate_america_feel/gtpt724/
gtpt7aw,1617819812,-22,t1_gtpnxkk,"“The rules are different in the courtroom, what once was viable in clown world wont fly anymore. Just facts and that helps the defense.”

Like Trump found out when his 60 lawsuits for election fraud were shot down in court?",/r/Conservative/comments/mm7dh9/day_7_of_chauvins_trial_was_a_train_wreck_of_a/gtpt7aw/
gtpt93e,1617819833,4,t1_gtpt30y,So have laws regulating voting.,/r/Conservative/comments/mm6g90/factcheck_colorado_makes_voting_far_easier_than/gtpt93e/
gtpta99,1617819847,1,t3_mm70pz,Once again proving that women belong in the kitchen.,/r/Conservative/comments/mm70pz/this_is_an_invasion_of_my_privacy_joy_behar_is/gtpta99/
gtptabt,1617819848,5,t1_gtpsh2h,So I'm guessing you're living (trapped behind enemy lines) in Illinois like I am?,/r/Conservative/comments/mm8ayc/bidens_gun_control_executive_orders_are_imminent/gtptabt/
gtptazu,1617819857,2,t3_mm70pz,Then maybe her stupid ass should stay at home,/r/Conservative/comments/mm70pz/this_is_an_invasion_of_my_privacy_joy_behar_is/gtptazu/
gtpteov,1617819900,3,t1_gtprx41,"&gt;Now let’s add challenging any voters eligibility to vote. Came to the wrong polling place? Disqualified. Wrong district? Disqualified. New address? Disqualified. Signature doesn’t match? Disqualified.

As it should be. You are registered to vote in one precinct. One. Its location is on your voter registration card. Go there to vote. Go anywhere else, and it's very likely you're committing voter fraud.",/r/Conservative/comments/mm6g90/factcheck_colorado_makes_voting_far_easier_than/gtpteov/
gtpteu8,1617819901,4,t3_mm8h78,It’s not a blue or red sport. It’s a boring sport. Baseball games are fun to go to and it’s good background noise on tv I guess,/r/Conservative/comments/mm8h78/sen_john_kennedy_rla_mlb_commissioners_decision/gtpteu8/
gtptgwc,1617819926,1,t1_gtpq0o8,Lee and Jackson would like a few words lol,/r/Conservative/comments/mm73aj/biden_to_tear_down_wall_replace_with_more/gtptgwc/
gtptj8v,1617819955,1,t3_mm8fi0,"Tired of reporting this thread? [Donate to this charity instead](https://secure.givelively.org/donate/prevent-child-abuse-america/prevent-child-abuse-america/r-conservative). Alternatively, [join us on discord](https://discord.com/invite/conservative)

*I am a bot, and this action was performed automatically. Please [contact the moderators of this subreddit](/message/compose/?to=/r/Conservative) if you have any questions or concerns.*",/r/Conservative/comments/mm8fi0/biden_estate_tax_reform_plan_will_raise_taxes_on/gtptj8v/
gtptkk7,1617819970,13,t3_mm8ayc,"&gt; ""Biden will direct the administration to begin the process of requiring buyers of so-called ghost guns — homemade or makeshift firearms that lack serial numbers — to undergo background checks, according to three people who have spoken to the White House about the plans.

Lol good luck with that. Background checks for buying an aluminum block?",/r/Conservative/comments/mm8ayc/bidens_gun_control_executive_orders_are_imminent/gtptkk7/
gtptkze,1617819975,4,t1_gtpgt9d,"You forgot your ""/s"" tag. Non-citizens and underage people aren't supposed to be voting.",/r/Conservative/comments/mm6g90/factcheck_colorado_makes_voting_far_easier_than/gtptkze/
gtptnp2,1617820008,4,t1_gtphyuw,"Prayer is private (but public prayer is common in the New Testament), but church is also praise and that is to be public.",/r/Conservative/comments/mm6iw3/after_throwing_their_pastor_in_jail_for/gtptnp2/
gtptoo7,1617820020,4,t3_mm8ayc,I think at this point he is just succumbing to pressure to pass something to do with gun control however ineffective because he knows that anything remotely true to his desired legislation will never pass and if forced through I could honestly see leading to actual succession. This is all so the democrats have another brownie point for their voters that despise guns. See we did something!!!,/r/Conservative/comments/mm8ayc/bidens_gun_control_executive_orders_are_imminent/gtptoo7/
gtptpjg,1617820030,1,t1_gtph8oo,As soon as gaetz does,/r/Conservative/comments/mm62k9/cuomo_repeals_his_nursing_home_legal_immunity/gtptpjg/
gtptpnc,1617820032,2,t1_gtpsm53,Exactly.,/r/Conservative/comments/mm8ayc/bidens_gun_control_executive_orders_are_imminent/gtptpnc/
gtpts5a,1617820060,17,t1_gtptabt,Sorry friend. The free state of Florida. Guns bars jobs and beaches for everyone. Our gov stops by events to drink beers with folks sometimes.,/r/Conservative/comments/mm8ayc/bidens_gun_control_executive_orders_are_imminent/gtpts5a/
gtptz3e,1617820142,7,t1_gtpr5d4,"It’s going to burn either way. Convict and they riot in celebration, acquit and they riot in rage.",/r/Conservative/comments/mm7dh9/day_7_of_chauvins_trial_was_a_train_wreck_of_a/gtptz3e/
gtpu6i9,1617820228,4,t3_mm6g90,"Man they are still trying to push the number of Ballot boxes.

THAT WAS A PANDEMIC RESPONSE AND PRIOR TO 2020 THERE WERE ZERO BOXES.

Which also makes their point about the number of mail in ballots ridiculous because Colorado was already moving into more mail in ballots compared to Georgia who got pushed into it for the pandemic. 

SO what makes Colorado FAR EASIER.  Ballots just get sent out in the mail. After you voted once before you dont need to prove who you are. 

And that makes Georgia Jim Crow Era?",/r/Conservative/comments/mm6g90/factcheck_colorado_makes_voting_far_easier_than/gtpu6i9/
gtpu934,1617820258,-2,t1_gtpn8p8,"&gt;You're the one who thinks ""people in urban place""

You are trying to call me racist. 

By ""people in urban places"" I mean cities, the population centers that are far more likely to vote for Democrats.

https://www.loc.gov/item/2012587691/

https://brilliantmaps.com/2016-county-election-map/

The results by total popular vote show that Democrats win. But because Democrats are highly concentrated in urban areas Republicans have the majority in a whole lot of counties.

&gt;are too dumb to bring a bottle of water with them.

There is nothing wrong with giving out stuff, so long as it's not influencing voters. Giving out water to anybody who wants it is very different than trading water for votes or excluding a political party.",/r/Conservative/comments/mm6g90/factcheck_colorado_makes_voting_far_easier_than/gtpu934/
gtpubul,1617820291,-3,t1_gtpscpv,You’re either trolling or verifiably insane. Or both.,/r/Conservative/comments/mm670w/dr_fauci_is_left_stammering_incoherently_after/gtpubul/
gtpudeo,1617820310,1,t1_gtpoki0,Amazon sells so many products on a daily basis that a simple two cent price increase nets them billions.,/r/Conservative/comments/mm6eb2/jeff_bezos_just_endorsed_corporate_tax_hikes/gtpudeo/
gtpuefo,1617820322,1,t3_mm8mkx,[removed],/r/Conservative/comments/mm8mkx/hunter_biden_gives_an_excuse_for_his_dealings/gtpuefo/
gtpuhig,1617820359,1,t3_mm8h78,He's right. If a known GOP-voter watches MLB the police will kick down the door and arrest them.,/r/Conservative/comments/mm8h78/sen_john_kennedy_rla_mlb_commissioners_decision/gtpuhig/
gtpuieq,1617820370,4,t1_gtpge05,"https://www.google.com/amp/s/www.politico.com/amp/news/2021/04/07/andrew-giuliani-new-york-gubernatorial-run-479692

Nope",/r/Conservative/comments/mm6g4m/andrew_giuliani_son_of_rudy_giuliani_plans_to/gtpuieq/
gtpujik,1617820384,1,t3_mm6wk3,"Bee always buries the lead.       

&gt;If the bill passes, Democrats assure people that something like President Trump winning -- or any other Republican winning -- will never happen again. There are some concerns that the bill could be ruled unconstitutional, but Democrats say that would only happen if people interpret the Constitution as “some sort of document with words that actually mean things.”",/r/Conservative/comments/mm6wk3/democrats_warn_that_if_hr_1_isnt_passed/gtpujik/
gtpujkz,1617820385,3,t3_mm8mkx,Crack head logic,/r/Conservative/comments/mm8mkx/hunter_biden_gives_an_excuse_for_his_dealings/gtpujkz/
gtpult6,1617820412,1,t3_mm8mkx,[deleted],/r/Conservative/comments/mm8mkx/hunter_biden_gives_an_excuse_for_his_dealings/gtpult6/
gtpuo1d,1617820438,18,t1_gtpt7aw,"None of them went to court. Judges refused to hear them... big difference. Nobody was brave enough to overturn an ‘election’ that had already been called by the Media- hence the rush to declare Biden the winner in the middle of the night after they figured out how many votes they needed. You honestly believe Biden won Georgia? How many states had issues where they stopped counting on election night?- How many of those states did Biden end up ‘winning’?

You’re not paying attention are you?",/r/Conservative/comments/mm7dh9/day_7_of_chauvins_trial_was_a_train_wreck_of_a/gtpuo1d/
gtpuoxk,1617820449,10,t3_mm7dh9,Part of me is pretty excited to watch a few liberal city's burn down from my dirt road.,/r/Conservative/comments/mm7dh9/day_7_of_chauvins_trial_was_a_train_wreck_of_a/gtpuoxk/
gtpusp9,1617820494,1,t1_gtpmkgi,[deleted],/r/Conservative/comments/mm6g90/factcheck_colorado_makes_voting_far_easier_than/gtpusp9/
gtpusz5,1617820497,6,t1_gtpts5a,I can confirm I see no lies.,/r/Conservative/comments/mm8ayc/bidens_gun_control_executive_orders_are_imminent/gtpusz5/
