Id,Date_Created_Utc,Score,Parent_id,Body,Link
gtplrqg,1617816633,4,t1_gtpjrbo,"Felix's Law.  The best case scenario here is that you think ""people in urban places"" (and we all know what you mean) are too stupid to find a ballot drop box, too stupid to take advantage of 17 days of early voting, and even too stupid to buy a bottle of water.  
  
That's the *best* case scenario, but I think we all know your real motive is making it easier to steal elections.",/r/Conservative/comments/mm6g90/factcheck_colorado_makes_voting_far_easier_than/gtplrqg/
gtpluc1,1617816664,1,t3_mm70pz,[removed],/r/Conservative/comments/mm70pz/this_is_an_invasion_of_my_privacy_joy_behar_is/gtpluc1/
gtplwkm,1617816690,6,t3_mm77ro,"I'm not listening to any of their fake news stories about Gaetz, until charges are brought.  I've seen this exact pattern of lies from the media for 4 years under Trump. Well 6 years of you count the run up to election.",/r/Conservative/comments/mm77ro/donald_trump_denies_matt_gaetz_asked_him_for_a/gtplwkm/
gtplwkz,1617816690,15,t1_gtpi1hw,"Kyle Rittenhouse was the same age and he is charged as an adult with multiple counts of murder, for shooting people **who were trying to kill him**.",/r/Conservative/comments/mm6nrq/dc_police_chief_prosecuting_teen_who_killed_uber/gtplwkz/
gtplyu8,1617816717,8,t3_mm73aj,I thought monuments were racist.,/r/Conservative/comments/mm73aj/biden_to_tear_down_wall_replace_with_more/gtplyu8/
gtplz85,1617816722,1,t3_mm6nrq,Well that applies to every murder so....just let them go?,/r/Conservative/comments/mm6nrq/dc_police_chief_prosecuting_teen_who_killed_uber/gtplz85/
gtpm3z9,1617816779,10,t3_mm70pz,Does she even know what invasion of privacy means...,/r/Conservative/comments/mm70pz/this_is_an_invasion_of_my_privacy_joy_behar_is/gtpm3z9/
gtpm4af,1617816783,5,t1_gtpl058,"I *am* discussing the article.  The article implies it's some heinous burden to ""show a form of photo identification"" when voting.  So why do you think photo ID should be required for flying, driving, buying a gun, getting a beer, getting cigarettes, etc. but not for voting?",/r/Conservative/comments/mm6g90/factcheck_colorado_makes_voting_far_easier_than/gtpm4af/
gtpm4lh,1617816786,5,t1_gtpgw0o,There’s more to it than just voter ID,/r/Conservative/comments/mm6g90/factcheck_colorado_makes_voting_far_easier_than/gtpm4lh/
gtpm5uf,1617816801,1,t1_gtplwkm,Yeah like Gym Jordan. Those kids where Antifa plants!!,/r/Conservative/comments/mm77ro/donald_trump_denies_matt_gaetz_asked_him_for_a/gtpm5uf/
gtpm7pv,1617816824,5,t1_gtpi0ez,It's a slap on the wrist if you look the right way,/r/Conservative/comments/mm6nrq/dc_police_chief_prosecuting_teen_who_killed_uber/gtpm7pv/
gtpm82h,1617816828,1,t3_mm70pz,[removed],/r/Conservative/comments/mm70pz/this_is_an_invasion_of_my_privacy_joy_behar_is/gtpm82h/
gtpmcco,1617816880,7,t1_gtplwkz,Ummm!!!!  Exactly!  Let’s see how the left would feel about charging Rittenhouse as a minor.  The hypocrisy is insane.  Such a double standard.,/r/Conservative/comments/mm6nrq/dc_police_chief_prosecuting_teen_who_killed_uber/gtpmcco/
gtpmg4v,1617816924,6,t1_gtplwkz,This is a great point that I have not been seeing. I will push this comparison forwards for the good fight. Thank you.,/r/Conservative/comments/mm6nrq/dc_police_chief_prosecuting_teen_who_killed_uber/gtpmg4v/
gtpmjyq,1617816970,0,t1_gtpjks8,"Here’s an interesting article about MAGA:

https://getpocket.com/explore/item/the-five-universal-laws-of-human-stupidity?utm_source=pocket-newtab",/r/Conservative/comments/mm6u7q/marjorie_taylor_greene_sees_32m_fundraising/gtpmjyq/
gtpmkgi,1617816976,-2,t1_gtpldri,"So what you are saying is the correct response to shady shit is to target democrat party voters? That's what this does. Urban areas are much more likely to vote Democrat, and this is designed to make it harder for people in urban areas to vote.",/r/Conservative/comments/mm6g90/factcheck_colorado_makes_voting_far_easier_than/gtpmkgi/
gtpmm4z,1617816995,12,t3_mm70pz,I doubt anyone wants to be near her 😂,/r/Conservative/comments/mm70pz/this_is_an_invasion_of_my_privacy_joy_behar_is/gtpmm4z/
gtpmn9w,1617817008,1,t3_mm73aj,"Next up will be reversing course on the pipeline ban and the corporate tax hikes. Unfortunately, the Democrats have to learn the hard way which means that people will have to suffer first.",/r/Conservative/comments/mm73aj/biden_to_tear_down_wall_replace_with_more/gtpmn9w/
gtpmnn1,1617817013,11,t3_mm7dh9,This guy makes Marcia Clark look like Atticus Finch.,/r/Conservative/comments/mm7dh9/day_7_of_chauvins_trial_was_a_train_wreck_of_a/gtpmnn1/
gtpmu80,1617817090,-3,t1_gtplrqg,"&gt; That's the best case scenario, but I think we all know your real motive is making it easier to steal elections.

I see, you are a bigot. Get lost troll.",/r/Conservative/comments/mm6g90/factcheck_colorado_makes_voting_far_easier_than/gtpmu80/
gtpmujc,1617817094,1,t1_gtpm5uf,What story?,/r/Conservative/comments/mm77ro/donald_trump_denies_matt_gaetz_asked_him_for_a/gtpmujc/
gtpmvlg,1617817107,3,t1_gtplyu8,"Right.  But this will cost 3x as much, then there is the voting law in Atlanta, and Texas, and the cops, oh the cops. And masks. Masks are a needed something with the covid, c'mon man... they are fixing the thing",/r/Conservative/comments/mm73aj/biden_to_tear_down_wall_replace_with_more/gtpmvlg/
gtpmxqh,1617817131,2,t3_mm670w,Quack,/r/Conservative/comments/mm670w/dr_fauci_is_left_stammering_incoherently_after/gtpmxqh/
gtpmyps,1617817142,7,t1_gtpmcco,"It's not even a double standard. One is a case of self defense. The other is a brutal case of first degree murder, a murder in the commission of a robbery.       

What the actual fuck. First degree murder of an innocent man committed openly on the street in the middle of the afternoon. Juvenile probation????",/r/Conservative/comments/mm6nrq/dc_police_chief_prosecuting_teen_who_killed_uber/gtpmyps/
gtpmzos,1617817154,-12,t1_gtpj6a6,"Some people don't feel comfortable getting covid-19.  This sub is full of christian conservative claimers, but only really believe in the GQP.  What christian would vote for trump, lol.  A FAKE ONE, duh.  All lip-service.",/r/Conservative/comments/mm6iw3/after_throwing_their_pastor_in_jail_for/gtpmzos/
gtpn133,1617817171,22,t3_mm7dh9,"""The cross-examination of Nicole MacKenzie, the state’s medical care training expert, was so bad that the defense plans to re-call MacKenzie as a defense witness.""

Wow.",/r/Conservative/comments/mm7dh9/day_7_of_chauvins_trial_was_a_train_wreck_of_a/gtpn133/
gtpn5mw,1617817226,-1,t1_gtpm4lh,No there isn't.  The crux of the matter is whether there should be any sort of standard for verifying the vote is being cast by the actual voter.,/r/Conservative/comments/mm6g90/factcheck_colorado_makes_voting_far_easier_than/gtpn5mw/
gtpn6vy,1617817241,1,t1_gtpjrbo,"The reason they want to limit mail in ballots is because it’s ripe for fraud. Here’s Jerry Nadler of the Democrats to tell you that himself. 

https://youtu.be/HoHDxiANFM4

Mail in ballots were a massive no no before they wanted to oust Trump.",/r/Conservative/comments/mm6g90/factcheck_colorado_makes_voting_far_easier_than/gtpn6vy/
gtpn8p8,1617817263,6,t1_gtpmu80,"You're the one who thinks ""people in urban place"" are too dumb to bring a bottle of water with them.",/r/Conservative/comments/mm6g90/factcheck_colorado_makes_voting_far_easier_than/gtpn8p8/
gtpn9ku,1617817274,2,t1_gtpiazc,"&gt;To prevent people from stealing ballots from mailboxes

To really prevent that you gotta figure out how they're pulling it off. They can't just be walking around opening mailboxes and hoping there's a ballot in it; that's too conspicuous and you'd never get enough ballots. Somehow these people know:

* Which house is getting a ballot
* When the ballot gets delivered
* That they have clandestine access to the mailbox during the window between when it's delivered and the resident checks the mail
* That the resident wasn't already going to vote for their preferred candidate anyway
* That the resident won't report that the ballot didn't arrive

They're getting that information from somewhere and until we can cut off whatever sleazy backchannel they're getting it from, they'll be getting away with this for a while.",/r/Conservative/comments/mm6g90/factcheck_colorado_makes_voting_far_easier_than/gtpn9ku/
gtpnew6,1617817337,7,t3_mm70pz,How the AF do these fopdoodles make it “big” with such simple minds? Only in America can proper nutters and loons become millionaires.,/r/Conservative/comments/mm70pz/this_is_an_invasion_of_my_privacy_joy_behar_is/gtpnew6/
gtpng2k,1617817351,2,t1_gtpi9sw,[deleted],/r/Conservative/comments/mm6l8h/its_high_time_we_make_woke_corporate_america_feel/gtpng2k/
gtpnkmn,1617817405,10,t1_gtpn133,"That was just the first paragraph, lol the whole article is a big WOW",/r/Conservative/comments/mm7dh9/day_7_of_chauvins_trial_was_a_train_wreck_of_a/gtpnkmn/
gtpnn76,1617817435,2,t3_mm6nrq,"well, the logic used ""it wont be bring anyone back"" is of course flawed.  why not apply that to every situation and hand every one a 5 year sentence for murder?

what we all seek is consistency. for underage people this can get difficult.  regardless of age, it seems totally wrong to release any minor at the age of 21. 

maybe the middle ground is that the minor is held in a juvi facility, and when they turn 21, they have to serve an additional 10 years minimum in a low security facility.  

but if this actually happens, and i was part of the victims family, i might want to visit the monsters that killed my relative when they are released. have a conversation.",/r/Conservative/comments/mm6nrq/dc_police_chief_prosecuting_teen_who_killed_uber/gtpnn76/
gtpnp6f,1617817459,1,t3_mm6h1x,[removed],/r/Conservative/comments/mm6h1x/youtube_censors_florida_governor_desantis_and_his/gtpnp6f/
gtpnptp,1617817467,1,t1_gtpmjyq,[deleted],/r/Conservative/comments/mm6u7q/marjorie_taylor_greene_sees_32m_fundraising/gtpnptp/
gtpnqy2,1617817480,4,t1_gtpn5mw,"The bill, known as SB 202, gives state-level officials the authority to usurp the powers of county election boards — allowing the Republican-dominated state government to potentially disqualify voters in Democratic-leaning areas. It criminalizes the provision of food and water to voters waiting in line, in a state where lines are notoriously long in heavily nonwhite precincts. It requires ID for absentee ballots and limits the placement of ballot drop boxes.

An analysis of data collected by Georgia Public Broadcasting and ProPublica found a significant disparity in who had to wait the longest: The average wait time after the 7 p.m. scheduled poll-closing time was 51 minutes in polling places that were 90% or more non-White. But it was just six minutes in polling places where 90% of the voters were White.

Voting rights advocates say that makes it all the more troubling that Georgia's law now makes it a misdemeanor to approach a voter in line to provide food or water.

-Voting hours and drop boxes

The law now requires officials to house drop boxes for absentee ballots inside early voting locations, which limits their usefulness. The law also specifies that early voting hours must run from 9 a.m. to 5 p.m., but it gives county registrars the flexibility to extend hours to 7 a.m. to 7 p.m.

Voting advocates argue that Black voters are more likely to work multiple jobs than Georgians of other races and limiting their access to drop boxes closes off yet another avenue to the franchise.

Voter challenges

The law says any Georgian can challenge the voting eligibility of an unlimited number of voters. Activists say this will make it to easier for conservative groups to attempt to purge large groups of Black voters or others they think will support Democrats.

Attempts to challenge voters' eligibility are not new. Ahead of January US Senate runoffs, Texas-based conservative organization True the Vote paired up with the Georgia Republican Party and tried to challenge more than 360,000 Georgia voters that it said may have changed addresses. Most counties declined to take up the matter.

Georgia's law adds a new provision that allows the State Elections Board to sanction counties that refuse to comply with the provision allowing unlimited challenges.

Some sources :

https://www.vox.com/22352112/georgia-voting-sb-202-explained

https://publicintegrity.org/politics/elections/ballotboxbarriers/analysis-voter-suppression-never-went-away-tactics-changed/

Just to clear some info up (not speaking for all Georgians, just family and friends from hometown) there’s not a real problem with voter IDs among people. (You might’ve seen the article floating around conservative   https://www.washingtonexaminer.com/news/poll-75-percent-americans-support-voter-ID )

A small hassle but sure whatever is the general response and most people already have a ID. This is a narrative created to combat what the real issue is. The problem is the voting hours, (people get off work at 5PM why close polling locations at 5PM? That’s sketch) , trying to stop souls to the polls (again what is wrong going to vote with your church family?), obviously making water illegal to handout. I don’t believe for one a second a person who is determined to wait in line for hours in this Georgia humid heat would be easily swayed to vote for the other candidate because he/she got a bottle of water. Everyone in GA (Atlanta/Savannah/Macon/mostly) knows how long it is to vote and usually comes prepared to wait for some time. Do you think that their minds could be changed when they already decided to vote for their candidate with the knowledge of the long lines?

Let’s be realistic here. Again. No one here (GA) really cares about voter ID that’s easy and simple and most people already have a valid form of ID. It’s the other things in the bill. 

You can’t seriously think a bill with as many pages as 300 is simply for voter ID.",/r/Conservative/comments/mm6g90/factcheck_colorado_makes_voting_far_easier_than/gtpnqy2/
gtpns08,1617817493,5,t3_mm6uqu,"Is this the gun that the ghost busters use? 

Good, ghost lives matter.",/r/Conservative/comments/mm6uqu/report_biden_to_take_new_executive_action_on/gtpns08/
gtpnvia,1617817535,1,t3_mm7m9t,[removed],/r/Conservative/comments/mm7m9t/my_official_senator_tier_list_what_do_you_think/gtpnvia/
gtpnwl6,1617817548,-8,t1_gtphlay,"Show your work. He’s been an advisor for over fifty years and worked with every president since Reagan. Just because you idiots made this a partisan issue doesn’t make him a hack, it makes you an idiot.",/r/Conservative/comments/mm670w/dr_fauci_is_left_stammering_incoherently_after/gtpnwl6/
gtpnwnj,1617817549,1,t3_mm7mll,"Tired of reporting this thread? [Donate to this charity instead](https://secure.givelively.org/donate/prevent-child-abuse-america/prevent-child-abuse-america/r-conservative). Alternatively, [join us on discord](https://discord.com/invite/conservative)

*I am a bot, and this action was performed automatically. Please [contact the moderators of this subreddit](/message/compose/?to=/r/Conservative) if you have any questions or concerns.*",/r/Conservative/comments/mm7mll/this_high_tech_sauna_blanket_uses_infrared_light/gtpnwnj/
gtpnxkk,1617817560,26,t1_gtpn133,"Funny what ""under oath"" brings out. No more pretty white lies, vague inferences ot bold assumptions now that there are actual repercussions for spouting off garbage. The rules are different in the courtroom, what once was viable in clown world wont fly anymore. Just facts, and that helps the defence. The only solid play the prosecution has is emotion and, unfortunately, too many people heed emotion before logic.",/r/Conservative/comments/mm7dh9/day_7_of_chauvins_trial_was_a_train_wreck_of_a/gtpnxkk/
gtpo0hc,1617817595,-2,t1_gtph2y8,You mean Mein Pillow?,/r/Conservative/comments/mm6h1x/youtube_censors_florida_governor_desantis_and_his/gtpo0hc/
gtpo0ns,1617817598,12,t1_gtpnkmn,It's amateur hour.  I'm picturing the stuttering defense attorney that wasn't Joe Pesci in My Cousin Vinny in court for the state.,/r/Conservative/comments/mm7dh9/day_7_of_chauvins_trial_was_a_train_wreck_of_a/gtpo0ns/
gtpo1ed,1617817606,5,t1_gtpmzos,What does this have to do with Trump..ah the type that can’t live in a world without trump to trash on. Ten years from now he will comment on anyone he disagrees with and call them a trumpster even though they don’t even know what he’s talking about. May as well be CNN. Bet his ratings are going down too.,/r/Conservative/comments/mm6iw3/after_throwing_their_pastor_in_jail_for/gtpo1ed/
gtpo42f,1617817639,8,t1_gtpityn,LOLOLOLOLOLOL imagine thinking he isn’t,/r/Conservative/comments/mm670w/dr_fauci_is_left_stammering_incoherently_after/gtpo42f/
gtpo5a7,1617817654,3,t1_gtpmzos,And what Christian would vote for Biden? so since there were 2 terrible people to choose from should they just not choose or flip a coin? Saying they can’t exercise their freedom of choice is stupid. And that also a terrible defense. Just because someone is not up to certain theological ideals doesn’t mean they are bad for the job. Look what Biden has done in 2 months compared to what trump did with 4 and use that as a measure rather than how Christian someone is buddy.,/r/Conservative/comments/mm6iw3/after_throwing_their_pastor_in_jail_for/gtpo5a7/
gtpo5c3,1617817654,3,t1_gtpmkgi,"Dont the urban areas still have 17 days of early voting 🤔 wtf are you even talking about man, seriously",/r/Conservative/comments/mm6g90/factcheck_colorado_makes_voting_far_easier_than/gtpo5c3/
gtpo7wb,1617817686,0,t1_gtpng2k,"Helps to read the article. It's not really talking about boycotts. It's talking about weaponizing government agencies against political opponents, a leftist specialty. Of course they own the gov't agencies, and the same corporations that own the Ds also own the Rs, so it's kind of a fait accompli at this point.",/r/Conservative/comments/mm6l8h/its_high_time_we_make_woke_corporate_america_feel/gtpo7wb/
gtpoapu,1617817719,-14,t1_gtpo42f,"The only people that think he is are part of an ever-shrinking minority of Q cultists. 

Enjoy irrelevancy.",/r/Conservative/comments/mm670w/dr_fauci_is_left_stammering_incoherently_after/gtpoapu/
gtpogo2,1617817789,3,t3_mm7mll,Wrong sub?,/r/Conservative/comments/mm7mll/this_high_tech_sauna_blanket_uses_infrared_light/gtpogo2/
gtpoi5g,1617817806,5,t3_mm70pz,She is welcome to socially distance herself from the so called unwashed masses and no one would miss her for it.,/r/Conservative/comments/mm70pz/this_is_an_invasion_of_my_privacy_joy_behar_is/gtpoi5g/
gtpoki0,1617817834,4,t3_mm6eb2,"I've been thinking about this, but I am not an economist. My theory is that the big businesses like Amazon can absorb the higher corporate tax, but smaller companies cannot. So big business will support the tax hike as an advantage over the smaller businesses and will have a net increase in profits by driving out the competition. Also, they can just raise prices. Someone smarter than me, evaluate and advise.",/r/Conservative/comments/mm6eb2/jeff_bezos_just_endorsed_corporate_tax_hikes/gtpoki0/
gtpoo6m,1617817877,-1,t1_gtpirnv,No on My Pillow but Yes on Flex Tape guy.,/r/Conservative/comments/mm6h1x/youtube_censors_florida_governor_desantis_and_his/gtpoo6m/
gtpopqk,1617817896,8,t1_gtpmnn1,In fairness it would take a miracle for any lawyer to make a case here.,/r/Conservative/comments/mm7dh9/day_7_of_chauvins_trial_was_a_train_wreck_of_a/gtpopqk/
gtpou9m,1617817950,1,t1_gtpiznt,Could you sell a homemade firearm in a cash and carry state legally? Asking for a friend.,/r/Conservative/comments/mm6uqu/report_biden_to_take_new_executive_action_on/gtpou9m/
gtpovod,1617817966,5,t1_gtpoapu,"Fraudci works for Biden and China, not the US. He's a bullshit generator.",/r/Conservative/comments/mm670w/dr_fauci_is_left_stammering_incoherently_after/gtpovod/
gtpow35,1617817971,6,t3_mm70pz,"Why would she be afraid if she has the vaccine protecting her?  On the other hand, would be a great way to mess with her though..",/r/Conservative/comments/mm70pz/this_is_an_invasion_of_my_privacy_joy_behar_is/gtpow35/
gtpowuk,1617817981,8,t3_mm6eb2,Always remember that people always vote in their own self interest. There is something suspicious about large companies backing something that would appear to be a disadvantage to them.,/r/Conservative/comments/mm6eb2/jeff_bezos_just_endorsed_corporate_tax_hikes/gtpowuk/
gtpoygo,1617818000,21,t3_mm7dh9,"Crowder covered this today. The prosecutions own witnesses completely eviscerated the case.        

The new video angle showed Chauvin didn't even have his knee on his neck most of the time, it was on his shoulder. You cannot suffocate someone by applying pressure to their shoulder. The prosecutor even changed what he was saying to include shoulder in the description of ""knee on the neck"".       

This case is over, on with the riots.",/r/Conservative/comments/mm7dh9/day_7_of_chauvins_trial_was_a_train_wreck_of_a/gtpoygo/
gtpoyv2,1617818005,-4,t1_gtpn6vy,*rife,/r/Conservative/comments/mm6g90/factcheck_colorado_makes_voting_far_easier_than/gtpoyv2/
gtpozw5,1617818017,5,t3_mm7dh9,The judge may throw it out after prosecution rests,/r/Conservative/comments/mm7dh9/day_7_of_chauvins_trial_was_a_train_wreck_of_a/gtpozw5/
gtpp3o5,1617818062,10,t3_mm7dh9,Get ready for riots.,/r/Conservative/comments/mm7dh9/day_7_of_chauvins_trial_was_a_train_wreck_of_a/gtpp3o5/
gtpp4hw,1617818072,15,t3_mm7dh9,"Prosecution:. ""Your Honor, I'd like to introduce Exhibit E, a statement from BLM activist, influencer and model Maya Nichols who said that 'All hell will break loose and buildings will burn' if Chauvin is found not guilty. It is my hope the jury takes this into consideration when deciding upon their verdict.""",/r/Conservative/comments/mm7dh9/day_7_of_chauvins_trial_was_a_train_wreck_of_a/gtpp4hw/
gtpp66g,1617818093,0,t1_gtpnqy2,"&gt; It criminalizes the provision of food and water to voters waiting in line

[Because Democrats were using food and drink to buy votes.](https://www.nationalreview.com/news/dem-abuses-prompted-georgia-voting-laws-food-and-drink-rule/)  
  
Why do you think black people are too stupid to pick up a bottle of water on their way to the poll?",/r/Conservative/comments/mm6g90/factcheck_colorado_makes_voting_far_easier_than/gtpp66g/
gtpp960,1617818129,1,t1_gtpkg7f,And we all know what they're going to use those kids for,/r/Conservative/comments/mm73aj/biden_to_tear_down_wall_replace_with_more/gtpp960/
gtppajh,1617818144,10,t3_mm7r4f,"You can imagine the fun they would have with this. Some Chinese internet troll tweets ""Doritos are a product of institutional racism"" and gullible American baizuo run with it.",/r/Conservative/comments/mm7r4f/wokeness_as_a_geopolitical_tool_author_says_china/gtppajh/
gtpperq,1617818194,6,t3_mm7r4f,Russia uses it too.,/r/Conservative/comments/mm7r4f/wokeness_as_a_geopolitical_tool_author_says_china/gtpperq/
gtppfw9,1617818208,1,t3_mm7mll,It’s a bad idea. Eat healthy and exercise.,/r/Conservative/comments/mm7mll/this_high_tech_sauna_blanket_uses_infrared_light/gtppfw9/
gtppgl1,1617818216,1,t1_gtpn8p8,[deleted],/r/Conservative/comments/mm6g90/factcheck_colorado_makes_voting_far_easier_than/gtppgl1/
gtpphrx,1617818231,1,t1_gtpm4af,"Voting is a right. Poll taxes are unconstitutional. Requiring ID, and not making the ID free is a poll tax. Make it free and I personally have no problem with it.

The Constitution specifically allows the regulation of firearms, and things like driving are not constitutionally guaranteed rights. I think that requiring ID to fly is an infringement on our freedom, and constitutionally questionable. But that is getting off topic.",/r/Conservative/comments/mm6g90/factcheck_colorado_makes_voting_far_easier_than/gtpphrx/
gtppict,1617818238,5,t3_mm7r4f,"Obviously. They even have a special word in Mandarin to make fun of woke westerners, Baizuo. 

The Chinese may be our geopolitical adversaries, but they are not stupid.",/r/Conservative/comments/mm7r4f/wokeness_as_a_geopolitical_tool_author_says_china/gtppict/
gtppilf,1617818241,1,t1_gtpo5a7,[removed],/r/Conservative/comments/mm6iw3/after_throwing_their_pastor_in_jail_for/gtppilf/
gtppkvw,1617818268,3,t1_gtpp4hw,Yep.,/r/Conservative/comments/mm7dh9/day_7_of_chauvins_trial_was_a_train_wreck_of_a/gtppkvw/
gtppn1g,1617818294,9,t1_gtpp3o5,And they'll blame it on white supremacists.,/r/Conservative/comments/mm7dh9/day_7_of_chauvins_trial_was_a_train_wreck_of_a/gtppn1g/
gtppngq,1617818299,13,t1_gtpp3o5,"Riots are coming no matter how this ends.  Even if the guy is found guilty the eventual punishment won't be harsh enough.  Also of note, Best Buy is finally restocked on large screen TV's.",/r/Conservative/comments/mm7dh9/day_7_of_chauvins_trial_was_a_train_wreck_of_a/gtppngq/
gtppnx3,1617818305,10,t1_gtpp3o5,We should hold everyone who has encouraged violence after a verdict is reached accountable for inciting insurrection if violence occurs.,/r/Conservative/comments/mm7dh9/day_7_of_chauvins_trial_was_a_train_wreck_of_a/gtppnx3/
gtppq1w,1617818330,3,t1_gtpi0f8,Agreed. There's a difference between trying to erase a person or company from an industry and deciding you won't spend your money at Amazon because they shutdown down Parler. Screw Coca Cola.,/r/Conservative/comments/mm6l8h/its_high_time_we_make_woke_corporate_america_feel/gtppq1w/
gtppqwf,1617818340,11,t1_gtpperq,Russia began running this tool since the cold war. Yuri Bezmenov warned us of it in the 80's.,/r/Conservative/comments/mm7r4f/wokeness_as_a_geopolitical_tool_author_says_china/gtppqwf/
gtppu2g,1617818377,3,t1_gtppajh,Honestly being a Chinese troll who targets leftists is probably an incredibly fun job. Other than the likely sweatshop work conditions,/r/Conservative/comments/mm7r4f/wokeness_as_a_geopolitical_tool_author_says_china/gtppu2g/
