Id,Date_Created_Utc,Score,Parent_id,Body,Link
gtpuuue,1617820519,2,t3_mm732h,[deleted],/r/Conservative/comments/mm732h/gillibrand_mocked_for_calling_child_care_paid/gtpuuue/
gtpuzwe,1617820579,1,t3_mm77ro,"Part of me hopes all this shit is true.

If we have another case of them covering a hit piece with 100x more airtime than them covering the inevitable unfolding of that story, I might just explode.

The media has no credibility at this point and it’s pathetic to see that so many Americans still fail to recognize they are nothing but a partisan arm of the Democratic Party.",/r/Conservative/comments/mm77ro/donald_trump_denies_matt_gaetz_asked_him_for_a/gtpuzwe/
gtpv4bj,1617820631,9,t1_gtptoo7,"&gt; pass something

An executive order isn't ""passing something."" It's the exact opposite. It's bypassing congress.",/r/Conservative/comments/mm8ayc/bidens_gun_control_executive_orders_are_imminent/gtpv4bj/
gtpv6mr,1617820659,1,t3_mm8q55,"""Go to Amazon and buy a spine..."" just made my day.",/r/Conservative/comments/mm8q55/sen_kennedy_blasts_mlb_commissioner_go_to_amazon/gtpv6mr/
gtpv74x,1617820664,3,t1_gtpn133,WOLOLO,/r/Conservative/comments/mm7dh9/day_7_of_chauvins_trial_was_a_train_wreck_of_a/gtpv74x/
gtpv92o,1617820688,5,t1_gtps0w2,Sheep,/r/Conservative/comments/mm6iw3/after_throwing_their_pastor_in_jail_for/gtpv92o/
gtpv93j,1617820688,2,t1_gtppict,"""All I mean is that Ballas have brains [..] they watch the news, they're making friends, cutting deals and tooling for more than half-assed drive-bys"" - Frank Tenpenny",/r/Conservative/comments/mm7r4f/wokeness_as_a_geopolitical_tool_author_says_china/gtpv93j/
gtpv9sd,1617820697,8,t1_gtpv4bj,"I agree, I misspoke.",/r/Conservative/comments/mm8ayc/bidens_gun_control_executive_orders_are_imminent/gtpv9sd/
gtpvbkl,1617820718,2,t3_mm830t,I have never heard of this conference.,/r/Conservative/comments/mm830t/andy_ngô_speech_canceled_by_christian_conference/gtpvbkl/
gtpvc2c,1617820724,2,t1_gtpsy2t,"Good talk, way to address what I said with an understanding of the situation outside your nuanced worldview.",/r/Conservative/comments/mm6g90/factcheck_colorado_makes_voting_far_easier_than/gtpvc2c/
gtpvfhn,1617820765,0,t1_gtprtj6,"The ""argument"" is to compare Georgia and Colorado. In Colorado a utility bill is good enough ID. Georgia's ID card requires more than a utility bill to get.

https://www.sos.state.co.us/pubs/elections/vote/acceptableFormsOfID.html

https://dds.georgia.gov/voter-id",/r/Conservative/comments/mm6g90/factcheck_colorado_makes_voting_far_easier_than/gtpvfhn/
gtpvnbc,1617820858,-16,t1_gtpuo1d,"Pretty telling that there wasn’t enough evidence to even merit a hearing. Trumps lawyers knew it and didn’t want to be embarrassed, or worse, in court when they couldn’t produce even a shred of evidence to back up their accusations. Many of the judges that dismissed these fraudulent cases were appointed by Trump himself. Btw bigfoot doesn’t exist either...",/r/Conservative/comments/mm7dh9/day_7_of_chauvins_trial_was_a_train_wreck_of_a/gtpvnbc/
gtpvody,1617820870,-2,t3_mm732h,Somehow this woman is more annoying than Hillary and Kamala.,/r/Conservative/comments/mm732h/gillibrand_mocked_for_calling_child_care_paid/gtpvody/
gtpvoxe,1617820877,1,t3_mm8s4h,[deleted],/r/Conservative/comments/mm8s4h/teen_vogue_admits_it_stopped_posting_on_social/gtpvoxe/
gtpvqhh,1617820896,6,t3_mm8ayc,Let’s remind viewers. Non of this is law.,/r/Conservative/comments/mm8ayc/bidens_gun_control_executive_orders_are_imminent/gtpvqhh/
gtpvrlw,1617820910,8,t3_mm8fi0,"Sadly most of the ""middle"" class can't afford to own property now anyway",/r/Conservative/comments/mm8fi0/biden_estate_tax_reform_plan_will_raise_taxes_on/gtpvrlw/
gtpvwh2,1617820968,1,t3_mm70pz,Why is this cow still relevant?,/r/Conservative/comments/mm70pz/this_is_an_invasion_of_my_privacy_joy_behar_is/gtpvwh2/
gtpvxsk,1617820983,3,t3_mm7r4f,We need to find a way to export our college professors and media personalities (can’t call them journalists anymore) to China. Call it a cultural exchange program for peace.,/r/Conservative/comments/mm7r4f/wokeness_as_a_geopolitical_tool_author_says_china/gtpvxsk/
gtpvy6k,1617820988,9,t3_mm8fi0,The end goal is to eliminate the middle class and return to serfdom.,/r/Conservative/comments/mm8fi0/biden_estate_tax_reform_plan_will_raise_taxes_on/gtpvy6k/
gtpvybe,1617820990,1,t3_mm830t,Sad,/r/Conservative/comments/mm830t/andy_ngô_speech_canceled_by_christian_conference/gtpvybe/
gtpw00i,1617821009,5,t3_mm88c3,Be nice if he joined opposition to voter fraud 6 months ago,/r/Conservative/comments/mm88c3/brian_kemp_joins_opposition_to_statemandated/gtpw00i/
gtpw0ww,1617821020,10,t1_gtpr458,"and the blame would fall squarely on the media for not accurately reporting what has actually been happening in the court room. I'm no police apologist, but the prosecution is not making a compelling case at all, and even when i think they are scoring points, the defense steamrolls them on cross. Once Nelson gets to go on offense and present his case, its going to be a bloodbath. This prosecution team seems not to be prepared at all.",/r/Conservative/comments/mm7dh9/day_7_of_chauvins_trial_was_a_train_wreck_of_a/gtpw0ww/
gtpw5hr,1617821074,2,t3_mm73aj,"Save money,  just use the barbed wire topped fencing and soldiers surrounding the capital.  They are only there as protection from the selfie brigade.",/r/Conservative/comments/mm73aj/biden_to_tear_down_wall_replace_with_more/gtpw5hr/
gtpw80x,1617821103,2,t3_mm6nrq,"So by this police chiefs logic why do we bother holding murders responsible for their crimes anymore?  Why would we bother to
Hold the domestic abuser responsible or for beating his wife?  You can’t take back the physical, mental, or emotional trauma the wife suffered so what’s the point? 

This police chief is opening a can of worms and if this keeps up law and order will go further out the window.",/r/Conservative/comments/mm6nrq/dc_police_chief_prosecuting_teen_who_killed_uber/gtpw80x/
gtpwc04,1617821150,3,t1_gtpvfhn,I think you shouldn’t be able to vote without a valid I d. Georgia literally gives them out for free. All you gotta do is go to the dmv and they’ll give you one.,/r/Conservative/comments/mm6g90/factcheck_colorado_makes_voting_far_easier_than/gtpwc04/
gtpwgvf,1617821210,2,t3_mm70pz,It’s a good thing not a lot people want to be near her in the first place.,/r/Conservative/comments/mm70pz/this_is_an_invasion_of_my_privacy_joy_behar_is/gtpwgvf/
gtpwjvq,1617821246,1,t1_gtpuuue,That is a part of this bill,/r/Conservative/comments/mm732h/gillibrand_mocked_for_calling_child_care_paid/gtpwjvq/
gtpwkn5,1617821255,1,t1_gtpou9m,[removed],/r/Conservative/comments/mm6uqu/report_biden_to_take_new_executive_action_on/gtpwkn5/
gtpwmps,1617821280,3,t1_gtplm7w,Maternity leave is already paid through disability,/r/Conservative/comments/mm732h/gillibrand_mocked_for_calling_child_care_paid/gtpwmps/
gtpwo4t,1617821297,1,t1_gtpv74x,11,/r/Conservative/comments/mm7dh9/day_7_of_chauvins_trial_was_a_train_wreck_of_a/gtpwo4t/
gtpwp9z,1617821310,-1,t1_gtpteov,That is true,/r/Conservative/comments/mm6g90/factcheck_colorado_makes_voting_far_easier_than/gtpwp9z/
gtpwrcp,1617821335,3,t1_gtpsxay,I've never seen anyone fall up the stairs so bigly. Absolutely incredible!,/r/Conservative/comments/mm70pz/this_is_an_invasion_of_my_privacy_joy_behar_is/gtpwrcp/
gtpwvui,1617821388,1,t1_gtpv74x,I can't like this enough.  AoE was the best.,/r/Conservative/comments/mm7dh9/day_7_of_chauvins_trial_was_a_train_wreck_of_a/gtpwvui/
gtpwwfw,1617821395,2,t3_mm6nrq,This is such an asinine statement. Of course it won’t bring back someone’s loved one. That’s not the point. The point is punishment of the crime committed and to make sure the person doesn’t have the freedom to kill another person,/r/Conservative/comments/mm6nrq/dc_police_chief_prosecuting_teen_who_killed_uber/gtpwwfw/
gtpwwof,1617821398,2,t1_gtptgwc,Ahhh the OG democrats. Not much different except the OGs didnt even try to veil their racism.,/r/Conservative/comments/mm73aj/biden_to_tear_down_wall_replace_with_more/gtpwwof/
gtpwwtp,1617821400,6,t1_gtpmzos,"Lmao, well everyone there worshipping has made a risk assesment to attend. If you're scared YOU can fuckin stay home.",/r/Conservative/comments/mm6iw3/after_throwing_their_pastor_in_jail_for/gtpwwtp/
gtpwxct,1617821406,1,t1_gtpvc2c,"He's a troll. His responses are designed to get a rise, not honestly discuss this.",/r/Conservative/comments/mm6g90/factcheck_colorado_makes_voting_far_easier_than/gtpwxct/
gtpx34a,1617821473,0,t1_gtpsrgx,"Lol I voted trump 2016 fool. Yeah I’m liberal. I’m a independent. And people like yourself and the Republican freshman class are driving independents away from the party. 

Q me out",/r/Conservative/comments/mm6g90/factcheck_colorado_makes_voting_far_easier_than/gtpx34a/
gtpx4sw,1617821492,4,t1_gtps0w2,"It's not as serious as it's made to be, it's still killed less than smoking and way less than heart disease in the same year after millions contracted it. I don't see sugar or cigarettes being banned.",/r/Conservative/comments/mm6iw3/after_throwing_their_pastor_in_jail_for/gtpx4sw/
gtpx6sn,1617821515,1,t1_gtpgsby,Sadly no. Real news is more and more like satire lately. He has the last name to get votes though,/r/Conservative/comments/mm6g4m/andrew_giuliani_son_of_rudy_giuliani_plans_to/gtpx6sn/
gtpx76r,1617821519,-8,t1_gtpsnge,"These guys want to worship before everyone is vaccinated, they don't care if people die. They don't want to help and serve the sick, they just want to go into a building and say words in front of others.  You obviously voted for him.",/r/Conservative/comments/mm6iw3/after_throwing_their_pastor_in_jail_for/gtpx76r/
gtpx7ua,1617821527,12,t1_gtpvnbc,"They were all thrown out on procedure and standing, had nothing to do with evidence because nobody would touch it. That’s the part that’s telling- There’s plenty of evidence, his lawyers went to every state legislature involved in stopping the vote count but nobody would do anything because it had already been ‘called’ for Biden. How do you not see the conspiracy here? You believe what the television tells you? 

You screamed ‘Russia’ for four years yet somehow this election was flawless? Go put on three masks and get out of here.",/r/Conservative/comments/mm7dh9/day_7_of_chauvins_trial_was_a_train_wreck_of_a/gtpx7ua/
gtpxa1b,1617821552,6,t3_mm9345,If you purchase Patagonia from this point on you ARE part of the problem,/r/Conservative/comments/mm9345/patagonia_donates_1_million_to_defending/gtpxa1b/
gtpxcii,1617821581,3,t1_gtpts5a,I wanna move to Florida so badly. But I'm worried hell be gone in 2024 to run for pres and also the weather down there is so awful.,/r/Conservative/comments/mm8ayc/bidens_gun_control_executive_orders_are_imminent/gtpxcii/
gtpxdj9,1617821594,3,t3_mm88c3,"“Always voluntary” unless you want to work, or go outside home, or do anything freedom allows.",/r/Conservative/comments/mm88c3/brian_kemp_joins_opposition_to_statemandated/gtpxdj9/
gtpxhq5,1617821643,2,t1_gtpge05,What's wrong with Andrew Guiliani? Why is everyone upset by this?,/r/Conservative/comments/mm6g4m/andrew_giuliani_son_of_rudy_giuliani_plans_to/gtpxhq5/
gtpxn3r,1617821708,1,t1_gtph31g,His workers make way more than minimum wage... Why are you spouting leftist propaganda?,/r/Conservative/comments/mm6eb2/jeff_bezos_just_endorsed_corporate_tax_hikes/gtpxn3r/
gtpxpyp,1617821741,1,t1_gtpj9nq,His workers make double minimum wage. They are fine,/r/Conservative/comments/mm6eb2/jeff_bezos_just_endorsed_corporate_tax_hikes/gtpxpyp/
gtpxqkx,1617821748,1,t1_gtppngq,[removed],/r/Conservative/comments/mm7dh9/day_7_of_chauvins_trial_was_a_train_wreck_of_a/gtpxqkx/
gtpxsg5,1617821771,2,t3_mm6nrq,Justice is ***not supposed to*** bring the dead back to life.,/r/Conservative/comments/mm6nrq/dc_police_chief_prosecuting_teen_who_killed_uber/gtpxsg5/
gtpxsib,1617821771,2,t3_mm830t,"“... rapper Jason ""Propaganda"" Petty, who is fiercely critical of Ngô, has said he spoke with Qideas President Gabe Lyons about the speech.”  So, a guy self proclaimed as Propaganda, convinces a theological group that a speech yet to be given would be against their moral beliefs? WTAF kind of world are we in now?",/r/Conservative/comments/mm830t/andy_ngô_speech_canceled_by_christian_conference/gtpxsib/
gtpxsmg,1617821773,-1,t1_gtpo5c3,"That does not change what I said. It's a non-response at best, trolling at worst.",/r/Conservative/comments/mm6g90/factcheck_colorado_makes_voting_far_easier_than/gtpxsmg/
gtpy0e7,1617821864,21,t3_mm8yv0,"Liberals and the media will only accept a guilty verdict. Otherwise cities will burn, and they'll go after him another way.",/r/Conservative/comments/mm8yv0/chauvin_trial_day_7_wrapup_a_horrible_day_for_the/gtpy0e7/
gtpy5cd,1617821923,3,t1_gtpvnbc,"&gt;Pretty telling that there wasn’t enough evidence to even merit a hearing

No, again your understanding is superficial. The cases were dropped on procedural grounds, the reason and precedent being ""it was too late to change anything.""  In other words, if the court took the time to hear the case, even if they decided in Trumps favor, there could be no reversal. Thus hearing the case would be an exercise in futility.

Please dont fill the gaps in your understanding with convenient assumptions that back your preconceived notions.",/r/Conservative/comments/mm7dh9/day_7_of_chauvins_trial_was_a_train_wreck_of_a/gtpy5cd/
gtpy5zz,1617821930,0,t1_gtpt93e,I'm not saying that voting should be unregulated.,/r/Conservative/comments/mm6g90/factcheck_colorado_makes_voting_far_easier_than/gtpy5zz/
gtpy8m7,1617821961,16,t1_gtpn133,"I have two predictions


1: not guilty and the left will say it's a demonstration of the deep racism and white supremacy within America because a murderer cop went free.

2:two, guilty and the left will say it's proof of the deep racism and white supremacy within the police and America.",/r/Conservative/comments/mm7dh9/day_7_of_chauvins_trial_was_a_train_wreck_of_a/gtpy8m7/
gtpy8v5,1617821963,1,t1_gtpteu8,"Baseball used to be a wonderful sport, before politics started perverting it.",/r/Conservative/comments/mm8h78/sen_john_kennedy_rla_mlb_commissioners_decision/gtpy8v5/
gtpyd7v,1617822015,3,t1_gtpvfhn,"also all you need to get an id in Georgia is an out of state I d, or documents showing you legally live in the country and state of Georgia.",/r/Conservative/comments/mm6g90/factcheck_colorado_makes_voting_far_easier_than/gtpyd7v/
gtpydsf,1617822022,2,t1_gtpvy6k,Then they're doing a hell of a job.,/r/Conservative/comments/mm8fi0/biden_estate_tax_reform_plan_will_raise_taxes_on/gtpydsf/
gtpyfp5,1617822044,1,t3_mm6eb2,[removed],/r/Conservative/comments/mm6eb2/jeff_bezos_just_endorsed_corporate_tax_hikes/gtpyfp5/
gtpyhy3,1617822071,5,t1_gtpt7aw,"Wasn't 60, non of them went to court, you can't sure without damages lol..

Also his lawsuits were not even about fraud, they were about constitutional violations. Would you like another spoonful of msm horse manure though?",/r/Conservative/comments/mm7dh9/day_7_of_chauvins_trial_was_a_train_wreck_of_a/gtpyhy3/
gtpyig5,1617822077,1,t1_gtpwc04,"The problem is that obtaining the documents required to get an ID is more difficult than you would expect. Years ago my girlfriend at the time work at the Department of Child Services and she would frequently help her kids get an ID as they approached the 16-18 year old range. The problem is that if their parents did not keep or have their birth certificate and ssn, it is an actual nightmare to get those documents required to bring to the DMV. Even children who have been in DCS their entire lives and have the help a state employee by their side have trouble obtaining these documents. Blame that on their parents or state government incompetence as you will, but nevertheless it is much more difficult than just going to the DMV.",/r/Conservative/comments/mm6g90/factcheck_colorado_makes_voting_far_easier_than/gtpyig5/
gtpykih,1617822101,6,t1_gtpy8m7,All according to the script.,/r/Conservative/comments/mm7dh9/day_7_of_chauvins_trial_was_a_train_wreck_of_a/gtpykih/
gtpymjz,1617822126,1,t1_gtpubul,You are both indeed.,/r/Conservative/comments/mm670w/dr_fauci_is_left_stammering_incoherently_after/gtpymjz/
gtpymyv,1617822131,0,t3_mm830t,"I know Ngo is extremely critical of blm/antifa, maybe the conference was afraid of the potential controversy",/r/Conservative/comments/mm830t/andy_ngô_speech_canceled_by_christian_conference/gtpymyv/
gtpyn83,1617822134,2,t1_gtpx76r,https://youtu.be/eXWhbUUE4ko,/r/Conservative/comments/mm6iw3/after_throwing_their_pastor_in_jail_for/gtpyn83/
gtpyok9,1617822150,1,t3_mm9345,[removed],/r/Conservative/comments/mm9345/patagonia_donates_1_million_to_defending/gtpyok9/
gtpypvu,1617822166,2,t3_mm9345,More like Defending Genocide,/r/Conservative/comments/mm9345/patagonia_donates_1_million_to_defending/gtpypvu/
gtpyrmz,1617822187,0,t1_gtpymjz,Solid preschool burn!,/r/Conservative/comments/mm670w/dr_fauci_is_left_stammering_incoherently_after/gtpyrmz/
gtpys6d,1617822194,9,t1_gtpy0e7,Biden’s America,/r/Conservative/comments/mm8yv0/chauvin_trial_day_7_wrapup_a_horrible_day_for_the/gtpys6d/
gtpyu8s,1617822219,1,t3_mm7zx1,The retired assistant to Gaetz himself said that the claims against him are made up and false.,/r/Conservative/comments/mm7zx1/trump_has_to_correct_legacy_medias_false_claim/gtpyu8s/
gtpyv9e,1617822232,5,t3_mm99xy,"Since Arabs and Asians contributed a lot to mathematical theory, isn’t criticizing/changing math racist?",/r/Conservative/comments/mm99xy/equitable_math_californias_latest_plan_to/gtpyv9e/
gtpyvd0,1617822233,3,t1_gtpy5zz,"Yes you did.  You called showing ID a ""poll tax.""  If that's the case then showing ID - let alone a background check - is a clear violation of my right to bear arms.",/r/Conservative/comments/mm6g90/factcheck_colorado_makes_voting_far_easier_than/gtpyvd0/
gtpyyi3,1617822271,-14,t1_gtpx7ua,"When did I scream Russia?  And I will stay here as long as I choose. The bottom line is Chump lost, get on with your life old man",/r/Conservative/comments/mm7dh9/day_7_of_chauvins_trial_was_a_train_wreck_of_a/gtpyyi3/
gtpyz7t,1617822280,3,t1_gtpvc2c,Bad faith arguments don't deserve much more than sarcasm.,/r/Conservative/comments/mm6g90/factcheck_colorado_makes_voting_far_easier_than/gtpyz7t/
gtpz1gs,1617822306,20,t1_gtpy0e7,BLM won’t be happy unless they get to behead Chauvin in a public square,/r/Conservative/comments/mm8yv0/chauvin_trial_day_7_wrapup_a_horrible_day_for_the/gtpz1gs/
gtpz37q,1617822326,1,t3_mm6iw3,[removed],/r/Conservative/comments/mm6iw3/after_throwing_their_pastor_in_jail_for/gtpz37q/
gtpz7nn,1617822378,2,t3_mm677s,What NY needs is a recall election.,/r/Conservative/comments/mm677s/blue_new_york_identified_as_top_hot_spot_of_the/gtpz7nn/
gtpzab1,1617822409,13,t3_mm7dh9,"I had to watch ABC World News Tonight last night and the bullshit they were slinging about this case is incredible. If all you heard about this trial came from the MSM, you going to have the major shocked Pikachu face when they acquit him. That right there is what causes riots.",/r/Conservative/comments/mm7dh9/day_7_of_chauvins_trial_was_a_train_wreck_of_a/gtpzab1/
gtpzas9,1617822415,0,t1_gtpyvd0,"&gt; Yes you did. You called showing ID a ""poll tax.""

No I said requiring ID, and not making the ID free is a poll tax. Make it free and I personally have no problem with it.",/r/Conservative/comments/mm6g90/factcheck_colorado_makes_voting_far_easier_than/gtpzas9/
gtpzc64,1617822431,5,t3_mm7r4f,"All our adversaries view our racial/ethnic/religious diversity as a weakness to exploit.  And they are just doing that, by creating all sorts of artificial problems to get us bickering and getting us divided more and more.

Meanwhile, just watch how our adversaries treat their own minimal diversity (hint, by persecution) and how openly racist they are in general.

Meanwhile, we have to listen to morons on a daily basis about how America is the worst racist and unjust country in the industrialized world.  As someone who has been in other countries long enough to experience daily life, I cannot begin to explain how moronic it all sounds.",/r/Conservative/comments/mm7r4f/wokeness_as_a_geopolitical_tool_author_says_china/gtpzc64/
gtpzcha,1617822435,-3,t3_mm8ilo,Statistic proof isn't a thing,/r/Conservative/comments/mm8ilo/statistic_proof_something_is_wrong_with_the_us/gtpzcha/
gtpze31,1617822454,4,t1_gtpy8m7,"option 3. jury votes guilty, judge overrides it, and holy shitsnacks grab some popcorn.",/r/Conservative/comments/mm7dh9/day_7_of_chauvins_trial_was_a_train_wreck_of_a/gtpze31/
gtpzf25,1617822466,-6,t1_gtpy5cd,"Chump lost. One termer. At least he made THAT small list. Im glad he crawled back under the rock from which he crawled. He lost to a senile, career bum. Lmao",/r/Conservative/comments/mm7dh9/day_7_of_chauvins_trial_was_a_train_wreck_of_a/gtpzf25/
gtpzgj1,1617822483,0,t3_mm98rw,NEVER.,/r/Conservative/comments/mm98rw/the_europeanized_usa/gtpzgj1/
gtpzitb,1617822510,8,t1_gtpqt8b,"Problem is, America looses out no matter how this shitshow ends:

Acquittal via multiple jurors voting not guilty: Everybody is a racist. Rioting.

Acquittal via a single juror voting not guilty: ""See, all it takes is for one rotten racist to spoil the bunch."" Double down on racism and more riots.

They find him guilty: Validation, nonstop media coverage, a continuation of this line of race-centric thinking which will only get worse. Total demoralization. Probably riots too, why not.

Hung jury: Racism is preventing ""justice."" RIOTS.",/r/Conservative/comments/mm7dh9/day_7_of_chauvins_trial_was_a_train_wreck_of_a/gtpzitb/
gtpzjrf,1617822522,1,t3_mm70pz,"She is vaccinated...why is she worried about someone that isn’t, being near her?  How is her privacy invaded?  This line of thinking is crazy.",/r/Conservative/comments/mm70pz/this_is_an_invasion_of_my_privacy_joy_behar_is/gtpzjrf/
gtpzkym,1617822536,1,t3_mm7r4f,Well duh!,/r/Conservative/comments/mm7r4f/wokeness_as_a_geopolitical_tool_author_says_china/gtpzkym/
gtpzq69,1617822598,-3,t1_gtpyhy3,I would respond if I knew what the hell you were saying...spell much?,/r/Conservative/comments/mm7dh9/day_7_of_chauvins_trial_was_a_train_wreck_of_a/gtpzq69/
gtpzqkx,1617822603,2,t3_mm8fi0,because no matter what he says he is a liar.,/r/Conservative/comments/mm8fi0/biden_estate_tax_reform_plan_will_raise_taxes_on/gtpzqkx/
gtpzrf5,1617822614,4,t3_mm8ilo,Anyone that can sit through that whole video deserves a fucking trophy.,/r/Conservative/comments/mm8ilo/statistic_proof_something_is_wrong_with_the_us/gtpzrf5/
gtpzsz3,1617822633,2,t3_mm7zx1,Where is proof that it’s false? I’m waiting for some strong proof,/r/Conservative/comments/mm7zx1/trump_has_to_correct_legacy_medias_false_claim/gtpzsz3/
gtpzuge,1617822651,8,t3_mm9d84,"While it’s clear they don’t all condone this behavior, I’m sure that too many liberals will see nothing wrong with this. Or will still find a way to spin it against DeSantis and the other Florida officials.",/r/Conservative/comments/mm9d84/emails_between_60_minutes_and_desantis_office/gtpzuge/
gtpzzxp,1617822719,11,t1_gtpz1gs,That still wouldn’t be enough.,/r/Conservative/comments/mm8yv0/chauvin_trial_day_7_wrapup_a_horrible_day_for_the/gtpzzxp/
gtq00t7,1617822730,1,t3_mm9dfd,[removed],/r/Conservative/comments/mm9dfd/biden_to_solve_poverty_with_one_trillion_doller/gtq00t7/
gtq040v,1617822769,1,t3_mm6nrq,Since when does that stop us from prosecuting people for crimes?,/r/Conservative/comments/mm6nrq/dc_police_chief_prosecuting_teen_who_killed_uber/gtq040v/
gtq045v,1617822771,2,t1_gtpnwl6,"Hahaha get off reddit and go make up some other bullshit about covid, Facui.",/r/Conservative/comments/mm670w/dr_fauci_is_left_stammering_incoherently_after/gtq045v/
gtq049u,1617822772,1,t1_gtpzas9,"[Oops!](https://dds.georgia.gov/identification-cards-fees)  
  
Georgia ID Card for Voting Purposes Only (NOTE: Must provide proof of valid voter registration)	8 Years	No Fee When Qualified",/r/Conservative/comments/mm6g90/factcheck_colorado_makes_voting_far_easier_than/gtq049u/
gtq04bu,1617822773,4,t1_gtpt7aw,Trump really living in your head rent free. Try to keep your comments relevant to the topic.,/r/Conservative/comments/mm7dh9/day_7_of_chauvins_trial_was_a_train_wreck_of_a/gtq04bu/
gtq04tu,1617822779,6,t3_mm9jce,"$50 it gets banned from YouTube, and maybe from the other big social media platforms too",/r/Conservative/comments/mm9jce/scientists_issue_open_letter_detailing_incorrect/gtq04tu/
gtq05am,1617822785,1,t3_mm9iu5,"The one remaining is Officer Sicknick, whose results are pending.

But we already know that the whole fire extinguisher story was false and it appears he died of a stroke the next day.",/r/Conservative/comments/mm9iu5/the_dc_medical_examiner_has_released_the_cause_of/gtq05am/
gtq05gt,1617822787,10,t1_gtpr458,So that's how the rest of Bidens infrastructure plan will be spent. Rebuilding cities after commie riots.,/r/Conservative/comments/mm7dh9/day_7_of_chauvins_trial_was_a_train_wreck_of_a/gtq05gt/
gtq05tf,1617822792,1,t1_gtpvqhh,"Sometimes the legislature creates bodies to make rules directed by the executive that are enforced with the legislature's authority by the executive.

So no it isn't law, but if it gets through rule making in one of those bodies, it won't matter since breaking the rules is in itself against the law.",/r/Conservative/comments/mm8ayc/bidens_gun_control_executive_orders_are_imminent/gtq05tf/
gtq05xv,1617822793,0,t3_mm8s4h,What is that thing?,/r/Conservative/comments/mm8s4h/teen_vogue_admits_it_stopped_posting_on_social/gtq05xv/
gtq0621,1617822795,5,t1_gtpzzxp,What if they play the black national anthem and jump on cop cars during it?,/r/Conservative/comments/mm8yv0/chauvin_trial_day_7_wrapup_a_horrible_day_for_the/gtq0621/
