Id,Date_Created_Utc,Score,Parent_id,Body,Link
gtpebez,1617813442,1,t3_mm64a0,Are we surprised Democrats just destroying everything and expect everyone to be happy about it,/r/Conservative/comments/mm64a0/seattle_parents_outraged_as_students_set_to/gtpebez/
gtpex2m,1617813700,3,t3_mm677s,It always was,/r/Conservative/comments/mm677s/blue_new_york_identified_as_top_hot_spot_of_the/gtpex2m/
gtpexpd,1617813708,3,t3_mm670w,Partisan mouth piece,/r/Conservative/comments/mm670w/dr_fauci_is_left_stammering_incoherently_after/gtpexpd/
gtpfgm4,1617813933,2,t3_mm677s,We have come full circle,/r/Conservative/comments/mm677s/blue_new_york_identified_as_top_hot_spot_of_the/gtpfgm4/
gtpfr08,1617814054,5,t3_mm677s,I mean they are kinda packed like sardines over there,/r/Conservative/comments/mm677s/blue_new_york_identified_as_top_hot_spot_of_the/gtpfr08/
gtpfriz,1617814061,3,t3_mm62k9,"While it’s beyond questionable why they even received immunity in the first place imagine that you were wary about the policy but you followed it both because it was the law of the land AND you knew you had immunity in case you were right and it was a stupid law, only to now be liable for all of Cuomo’s idiocy because you chose to follow the stupid law instead of being fined out of existence.  Now you just get to be sued out of existence instead.",/r/Conservative/comments/mm62k9/cuomo_repeals_his_nursing_home_legal_immunity/gtpfriz/
gtpg0dv,1617814164,0,t3_mm6df9, A lot of people it “killed” likely would have died anyway last year of other causes.,/r/Conservative/comments/mm6df9/the_covid19_response_is_killing_more_than_it_saves/gtpg0dv/
gtpge05,1617814324,4,t3_mm6g4m,Satire. 100%,/r/Conservative/comments/mm6g4m/andrew_giuliani_son_of_rudy_giuliani_plans_to/gtpge05/
gtpgo7n,1617814444,3,t3_mm6h1x,Sounds like a Law Suit!!!!,/r/Conservative/comments/mm6h1x/youtube_censors_florida_governor_desantis_and_his/gtpgo7n/
gtpgq39,1617814467,4,t3_mm6h1x,youtube is trash,/r/Conservative/comments/mm6h1x/youtube_censors_florida_governor_desantis_and_his/gtpgq39/
gtpgqe3,1617814470,4,t3_mm6h1x,Leftist sponsorship smh,/r/Conservative/comments/mm6h1x/youtube_censors_florida_governor_desantis_and_his/gtpgqe3/
gtpgsap,1617814492,1,t3_mm6ew0,"Can he get any stupider?
I say, YES!
More idiocracy coming daily. 
He's no leader, he's a fucking puppet.",/r/Conservative/comments/mm6ew0/biden_adds_stupidity_to_his_lies_about_georgias/gtpgsap/
gtpgsby,1617814493,1,t3_mm6g4m,.....satire flare ?,/r/Conservative/comments/mm6g4m/andrew_giuliani_son_of_rudy_giuliani_plans_to/gtpgsby/
gtpgt9d,1617814504,5,t3_mm6g90,"If we let every human who wants a ballot have one, no questions asked, then we will truly be free",/r/Conservative/comments/mm6g90/factcheck_colorado_makes_voting_far_easier_than/gtpgt9d/
gtpgtlo,1617814508,7,t3_mm6g90,The question isn’t whether one state makes it harder to vote than any other state. It’s whether any state makes it harder to vote for some residents in the state than other residents in the state. It does not. No state has laws that do that. They would instantly be struck down,/r/Conservative/comments/mm6g90/factcheck_colorado_makes_voting_far_easier_than/gtpgtlo/
gtpgw0o,1617814536,9,t3_mm6g90,"Oh good, another leftist who thinks black people are too stupid to vote or get an ID.  The Democratic Party hasn't changed since their slaveholding days.  
  
I coined the term Felix's Law for my observation that as a political discussion grows longer, the probability of a liberal admitting he thinks black people are stupid approaches 1.",/r/Conservative/comments/mm6g90/factcheck_colorado_makes_voting_far_easier_than/gtpgw0o/
gtpgx6j,1617814550,1,t3_mm6ew0,Didn't the left and media flip out over Pres. Trump saying that NFL players that took a knee should be fired. What a bunch of hypocrites.,/r/Conservative/comments/mm6ew0/biden_adds_stupidity_to_his_lies_about_georgias/gtpgx6j/
gtpgzz7,1617814583,1,t3_mm6ew0,"*that's up to the masters*

*uhhhhh*


Please get this man off our world stage lmao like wtf",/r/Conservative/comments/mm6ew0/biden_adds_stupidity_to_his_lies_about_georgias/gtpgzz7/
gtph008,1617814583,6,t3_mm6eb2,Amazon already infiltrated the highest echelons of government you gotta be pretty naive to believe they're going to disadvantage themselves in any way. So yeah all of this is theater.,/r/Conservative/comments/mm6eb2/jeff_bezos_just_endorsed_corporate_tax_hikes/gtph008/
gtph2y8,1617814617,-5,t3_mm6h1x,Isn’t one of his science advisors that fella from My Pillow?,/r/Conservative/comments/mm6h1x/youtube_censors_florida_governor_desantis_and_his/gtph2y8/
gtph31g,1617814618,1,t3_mm6eb2,Jeff also refuses to pay his workers a decent wage so I hope he does do something all this fucking money,/r/Conservative/comments/mm6eb2/jeff_bezos_just_endorsed_corporate_tax_hikes/gtph31g/
gtph5of,1617814649,1,t3_mm6g90,[removed],/r/Conservative/comments/mm6g90/factcheck_colorado_makes_voting_far_easier_than/gtph5of/
gtph6l3,1617814660,3,t3_mm677s,New york is like fucking Brazil with technology and first world resources so of course it's a hot spot,/r/Conservative/comments/mm677s/blue_new_york_identified_as_top_hot_spot_of_the/gtph6l3/
gtph70k,1617814665,2,t3_mm6jg1,I wonder which golfers get a Jim Eagle on the first hole?,/r/Conservative/comments/mm6jg1/a_masters_mulligan_biden_says_georgia_is_now_a/gtph70k/
gtph8oo,1617814684,1,t3_mm62k9,The real question is when is this pos gonna go down for mushing himself on woman,/r/Conservative/comments/mm62k9/cuomo_repeals_his_nursing_home_legal_immunity/gtph8oo/
gtphb6r,1617814714,7,t3_mm6kme,Did she have to show ID to run for mayor?,/r/Conservative/comments/mm6kme/atlanta_mayor_signs_executive_order_mitigating/gtphb6r/
gtphe9f,1617814750,1,t3_mm6kme,[removed],/r/Conservative/comments/mm6kme/atlanta_mayor_signs_executive_order_mitigating/gtphe9f/
gtphirb,1617814804,1,t3_mm6df9,"Tired of reporting this thread? [Donate to this charity instead](https://secure.givelively.org/donate/prevent-child-abuse-america/prevent-child-abuse-america/r-conservative). Alternatively, [join us on discord](https://discord.com/invite/conservative)

*I am a bot, and this action was performed automatically. Please [contact the moderators of this subreddit](/message/compose/?to=/r/Conservative) if you have any questions or concerns.*",/r/Conservative/comments/mm6df9/the_covid19_response_is_killing_more_than_it_saves/gtphirb/
gtphkgm,1617814823,3,t3_mm6jg1,"*its up to the masters*



.............



Publicly outspoken black here,


#KISS MY ASS JOE BIDEN FOREAL",/r/Conservative/comments/mm6jg1/a_masters_mulligan_biden_says_georgia_is_now_a/gtphkgm/
gtphlay,1617814833,5,t3_mm670w,He is such a piece of shit hack.,/r/Conservative/comments/mm670w/dr_fauci_is_left_stammering_incoherently_after/gtphlay/
gtphnd8,1617814858,1,t3_mm62k9,"&gt; The New York Democrat repealed the law as he faces an FBI investigation into his handling of nursing homes during the pandemic

If it's a state law, would not the legislature be required to repeal it?",/r/Conservative/comments/mm62k9/cuomo_repeals_his_nursing_home_legal_immunity/gtphnd8/
gtphp73,1617814881,2,t3_mm6kme,God forbid there are rules at all for elections.,/r/Conservative/comments/mm6kme/atlanta_mayor_signs_executive_order_mitigating/gtphp73/
gtphqsz,1617814900,9,t3_mm6iw3,Fascists,/r/Conservative/comments/mm6iw3/after_throwing_their_pastor_in_jail_for/gtphqsz/
gtphwpf,1617814972,13,t3_mm6nrq,"Uuuhhhhhhhhh, so no more murder trials ever?

Also, wonder what this dude thinks of the trial that the entire nation is watching right now.",/r/Conservative/comments/mm6nrq/dc_police_chief_prosecuting_teen_who_killed_uber/gtphwpf/
gtphygk,1617814992,2,t1_gtpg0dv,"By that logic, George Floyd would have died from the drugs in his system, so there’s no need to analyze anything else that happened to him that day.",/r/Conservative/comments/mm6df9/the_covid19_response_is_killing_more_than_it_saves/gtphygk/
gtphynw,1617814995,1,t3_mm6g90,[removed],/r/Conservative/comments/mm6g90/factcheck_colorado_makes_voting_far_easier_than/gtphynw/
gtphyuw,1617814997,-13,t3_mm6iw3,"what the big deal
&gt;     But thou, when thou prayest, enter into thy
&gt;     closet, and when thou hast shut thy door, pray
&gt;     to thy Father which is in secret; and thy Father
&gt;     which seeth in secret shall reward thee openly.
just fake christians and conservatives.",/r/Conservative/comments/mm6iw3/after_throwing_their_pastor_in_jail_for/gtphyuw/
gtphyz3,1617814998,4,t3_mm6kme,"Maybe literacy tests aren't so bad. 

It would stop idiots from voting their own into office.",/r/Conservative/comments/mm6kme/atlanta_mayor_signs_executive_order_mitigating/gtphyz3/
gtphznt,1617815006,-1,t3_mm6g90,Coloradoan here: can’t speak to GA’s law but it’s like the state of Colorado wants me to vote...they mail me my ballot and there are 3 drop boxes within a few miles of my house. Can’t imagine why a state would do anything else...,/r/Conservative/comments/mm6g90/factcheck_colorado_makes_voting_far_easier_than/gtphznt/
gtpi0ez,1617815016,18,t3_mm6nrq,"Cool, so murder is just a slap on the wrist now.   Got it",/r/Conservative/comments/mm6nrq/dc_police_chief_prosecuting_teen_who_killed_uber/gtpi0ez/
gtpi0f8,1617815016,8,t3_mm6l8h,"I’m all about boycotting companies you don’t agree with, and have been downvoted to hell here for saying so.

I hope conservatives start accepting that choosing which companies you support with your dollars isn’t “cancel culture.”",/r/Conservative/comments/mm6l8h/its_high_time_we_make_woke_corporate_america_feel/gtpi0f8/
gtpi1hw,1617815029,22,t3_mm6nrq,You know what else won't bring him back?  Treating these murderers with kid gloves.,/r/Conservative/comments/mm6nrq/dc_police_chief_prosecuting_teen_who_killed_uber/gtpi1hw/
gtpi4xf,1617815070,1,t3_mm6nrq,[removed],/r/Conservative/comments/mm6nrq/dc_police_chief_prosecuting_teen_who_killed_uber/gtpi4xf/
gtpi9sw,1617815126,3,t3_mm6l8h,Tell me which Republican politicians are going to take this kind of action,/r/Conservative/comments/mm6l8h/its_high_time_we_make_woke_corporate_america_feel/gtpi9sw/
gtpiaw6,1617815139,-1,t1_gtphygk,This seems like bait,/r/Conservative/comments/mm6df9/the_covid19_response_is_killing_more_than_it_saves/gtpiaw6/
gtpiazc,1617815140,13,t1_gtphznt,"&gt; Can’t imagine why a state would do anything else...

To prevent people from stealing ballots from mailboxes, filling them out, and dumping them in the drop boxes?",/r/Conservative/comments/mm6g90/factcheck_colorado_makes_voting_far_easier_than/gtpiazc/
gtpic7j,1617815155,11,t3_mm6nrq,What the actual fuck is happening... this is so disappointing...,/r/Conservative/comments/mm6nrq/dc_police_chief_prosecuting_teen_who_killed_uber/gtpic7j/
gtpicb9,1617815156,2,t3_mm6kme,I didn’t read all of that but it sounds like she wants people trained on the new law,/r/Conservative/comments/mm6kme/atlanta_mayor_signs_executive_order_mitigating/gtpicb9/
gtpiil6,1617815229,3,t3_mm6nrq,This can apply to any violent criminal...ffs DC is a joke.,/r/Conservative/comments/mm6nrq/dc_police_chief_prosecuting_teen_who_killed_uber/gtpiil6/
gtpims5,1617815280,9,t3_mm6nrq,"Ok, but prosecuting them might still discourage others from murdering people.",/r/Conservative/comments/mm6nrq/dc_police_chief_prosecuting_teen_who_killed_uber/gtpims5/
gtpimur,1617815281,9,t3_mm6nrq,I just don’t think it’s ok for joggers to kill Uber drivers. Maybe I’m just old fashioned that way,/r/Conservative/comments/mm6nrq/dc_police_chief_prosecuting_teen_who_killed_uber/gtpimur/
gtpind0,1617815286,3,t3_mm6h1x,"YouTube, I'm sorely disappointed in you for playing partisan politics.",/r/Conservative/comments/mm6h1x/youtube_censors_florida_governor_desantis_and_his/gtpind0/
gtpioqy,1617815303,8,t3_mm6nrq,I wonder if this guy would feel the same way of those two bitches had murdered a member of his family?,/r/Conservative/comments/mm6nrq/dc_police_chief_prosecuting_teen_who_killed_uber/gtpioqy/
gtpira0,1617815333,1,t3_mm6kme,[deleted],/r/Conservative/comments/mm6kme/atlanta_mayor_signs_executive_order_mitigating/gtpira0/
gtpirnv,1617815338,2,t1_gtph2y8,"Well, is he?",/r/Conservative/comments/mm6h1x/youtube_censors_florida_governor_desantis_and_his/gtpirnv/
gtpit4g,1617815355,4,t1_gtpimur,Racist. /s,/r/Conservative/comments/mm6nrq/dc_police_chief_prosecuting_teen_who_killed_uber/gtpit4g/
gtpityn,1617815365,-11,t1_gtpexpd,Lol imagine thinking Fauci is a mouthpiece.,/r/Conservative/comments/mm670w/dr_fauci_is_left_stammering_incoherently_after/gtpityn/
gtpiznt,1617815434,4,t3_mm6uqu,"lol, no.

&gt;purchasing “ghost guns,” homemade firearms without serial numbers, to undergo a federal background check. 

Tell me how you can legally transfer a 'ghost gun' under the current law.",/r/Conservative/comments/mm6uqu/report_biden_to_take_new_executive_action_on/gtpiznt/
gtpj25o,1617815464,0,t3_mm6l8h,"It's easier to just turn their double speak on them. 

Like when twitch tried to use Womxn and they were called antiwoman.",/r/Conservative/comments/mm6l8h/its_high_time_we_make_woke_corporate_america_feel/gtpj25o/
gtpj6a6,1617815513,11,t1_gtphyuw,This is still the government denying people the right to freely practice their religion as they want to and that’s what’s wrong. Some people don’t feel comfortable worshipping alone and like to gather so this is the form of worship they probably feel most at ease with. Doesn’t make them fake dude,/r/Conservative/comments/mm6iw3/after_throwing_their_pastor_in_jail_for/gtpj6a6/
gtpj86h,1617815535,5,t3_mm6nrq,Could you imagine the coverage this would have if they were both white and men/boys? This would be a 24 hour news story for the next 6-12 months,/r/Conservative/comments/mm6nrq/dc_police_chief_prosecuting_teen_who_killed_uber/gtpj86h/
gtpj9nq,1617815553,1,t1_gtph31g,Well I've heard that Jeff supplies the pee bottles that his workers use.  So there!,/r/Conservative/comments/mm6eb2/jeff_bezos_just_endorsed_corporate_tax_hikes/gtpj9nq/
gtpje4o,1617815606,3,t1_gtpi0f8,"Agreed! 

Cancel Culture and Boycotting are two different things. If a person makes a mistake and is cancelled that is silly as no one is perfect and if they self correct or are remorseful then we should allow them grace. However if a company continues to spit on the people that invest and support the Business withdrawing support indefinitely is the only way to to get their attention or even better allow competitors to rise and supplant them.",/r/Conservative/comments/mm6l8h/its_high_time_we_make_woke_corporate_america_feel/gtpje4o/
gtpjgc8,1617815633,2,t3_mm6uqu,"I feel safer already. Thank you for your bold stand Mr President. Idiots, all of them.",/r/Conservative/comments/mm6uqu/report_biden_to_take_new_executive_action_on/gtpjgc8/
gtpjj6z,1617815668,6,t3_mm6wk3,But that’s not really satire,/r/Conservative/comments/mm6wk3/democrats_warn_that_if_hr_1_isnt_passed/gtpjj6z/
gtpjks8,1617815687,2,t3_mm6u7q,"The people are fighting back against the political elite.        

They are testing out various different methods of political and media attacks on Cruz, Gaetz, Desantis, MTG. Notice they are all MAGA Republicans.       


Edit: I just donated $30 to match the poster under me!",/r/Conservative/comments/mm6u7q/marjorie_taylor_greene_sees_32m_fundraising/gtpjks8/
gtpjl74,1617815692,7,t3_mm6kme,"&gt; The executive order directs local officials to train staff members on voter registration and general information on early, absentee, and in-person voting

Damn, she sure showed us, by directing city employees to...do their jobs?

&gt; and provides that information to residents so they can obtain the identification required to vote.

That information is already provided to residents...

Amid a sea of pointless political posturing, I think we finally have the single most ineffectual proclamation issued by a government official.",/r/Conservative/comments/mm6kme/atlanta_mayor_signs_executive_order_mitigating/gtpjl74/
gtpjllf,1617815698,3,t1_gtpioqy,Guess what race he is? Guess which city would be rioting if the kids were white?,/r/Conservative/comments/mm6nrq/dc_police_chief_prosecuting_teen_who_killed_uber/gtpjllf/
gtpjo17,1617815728,5,t1_gtpj86h,"Years, they'd be bringing it up in the 2024 election.",/r/Conservative/comments/mm6nrq/dc_police_chief_prosecuting_teen_who_killed_uber/gtpjo17/
gtpjpky,1617815746,1,t3_mm6uqu,Any statistics on how often “ghost guns” are used in violent crimes? Is this really an attempt at curbing gun violence?,/r/Conservative/comments/mm6uqu/report_biden_to_take_new_executive_action_on/gtpjpky/
gtpjrbo,1617815768,-6,t1_gtpgtlo,"&gt;The question isn’t whether one state makes it harder to vote than any other state.

Really, you are going to outright lie to me now? Several articles have been massively upvoted here contradicting hat you are saying.

&gt; It’s whether any state makes it harder to vote for some residents in the state than other residents in the state. It does not.

You clearly did NOT read the article. ""Georgia’s new voting law reduces the number of ballot dropboxes to one per 100,000 voters in a county, or one per early voting site, whichever is fewer. For example, if a county has five polling locations but only 300,000 voters, it would only be allowed to have three dropboxes."" 

The intent behind this law is to make it harder for people in urban places to vote. It's super telling that they both limited the number of droboxes, put restrictions on mail in voting, and made it illegal to pass out water. This law does what you say would be struck down.",/r/Conservative/comments/mm6g90/factcheck_colorado_makes_voting_far_easier_than/gtpjrbo/
gtpjtz1,1617815799,4,t3_mm6nrq,So the immigrants life didn’t matter? I understand now.,/r/Conservative/comments/mm6nrq/dc_police_chief_prosecuting_teen_who_killed_uber/gtpjtz1/
gtpk1my,1617815893,-9,t1_gtpgw0o,"Oh good, another dishonest, rule troll conservative who is posting something that has nothing to do with the article. And getting upvoted for it too.",/r/Conservative/comments/mm6g90/factcheck_colorado_makes_voting_far_easier_than/gtpk1my/
gtpk296,1617815901,2,t3_mm6wk3,"What’s strange is that even though it’s intended to be satirical, it’s more accurate than the actual news.",/r/Conservative/comments/mm6wk3/democrats_warn_that_if_hr_1_isnt_passed/gtpk296/
gtpk4q4,1617815931,4,t3_mm6nrq,Remember when “stop Asian hate” was a thing.  Yea that lasted for about 1 week.,/r/Conservative/comments/mm6nrq/dc_police_chief_prosecuting_teen_who_killed_uber/gtpk4q4/
gtpk8j5,1617815976,2,t3_mm6nrq,So defund your police department and hire vigilantes to investigate the murders in your area,/r/Conservative/comments/mm6nrq/dc_police_chief_prosecuting_teen_who_killed_uber/gtpk8j5/
gtpka1l,1617815994,15,t3_mm70pz,Well we don't want to be close enough to hear her annoying ass voice anyway.,/r/Conservative/comments/mm70pz/this_is_an_invasion_of_my_privacy_joy_behar_is/gtpka1l/
gtpkam1,1617816000,4,t3_mm6wk3,Cant have that can we? /s only way they win is by stacking the deck.,/r/Conservative/comments/mm6wk3/democrats_warn_that_if_hr_1_isnt_passed/gtpkam1/
gtpkbhf,1617816010,8,t3_mm6g90,It’s a “fact check” since a liberal said it...nothing to see here. /s,/r/Conservative/comments/mm6g90/factcheck_colorado_makes_voting_far_easier_than/gtpkbhf/
gtpkc7g,1617816019,2,t3_mm6u7q,"That’s the nature of democracy. Total idiots and shallow ideologues WILL have their supporters.

No wonder we see her with that shit-eating grin in this photo.",/r/Conservative/comments/mm6u7q/marjorie_taylor_greene_sees_32m_fundraising/gtpkc7g/
gtpkf1x,1617816054,5,t3_mm70pz,Seems like an easy solution without having to do anything to them,/r/Conservative/comments/mm70pz/this_is_an_invasion_of_my_privacy_joy_behar_is/gtpkf1x/
gtpkfk6,1617816060,12,t3_mm70pz,I'm for nobody being allowed near her.,/r/Conservative/comments/mm70pz/this_is_an_invasion_of_my_privacy_joy_behar_is/gtpkfk6/
gtpkfv0,1617816063,1,t1_gtpicb9,Yup. She's hoping communication and training in her community will overcome the unintended consequence of reduced voter turnout from SB 202. Assuming that does end up being a consequence that is.,/r/Conservative/comments/mm6kme/atlanta_mayor_signs_executive_order_mitigating/gtpkfv0/
gtpkg7f,1617816067,2,t3_mm73aj,“Child migrant influx facilities”,/r/Conservative/comments/mm73aj/biden_to_tear_down_wall_replace_with_more/gtpkg7f/
gtpkgrv,1617816074,7,t1_gtpk1my,"OK.  Then what's your argument for why you should have to prove who you are when you want to fly on an airplane, drive a car, buy a gun, pick up MLB tickets, buy a beer, or buy a pack of smokes, but not when you want to vote?",/r/Conservative/comments/mm6g90/factcheck_colorado_makes_voting_far_easier_than/gtpkgrv/
gtpkhwp,1617816086,3,t3_mm70pz,If someone would violate her she'd be in a better mood.,/r/Conservative/comments/mm70pz/this_is_an_invasion_of_my_privacy_joy_behar_is/gtpkhwp/
gtpkndq,1617816151,0,t3_mm6kme,"___  race can’t spell their name or know who they are or read a # on their ID = racist.  

___ race is incapable of getting an ID =  defender of minorities.  

🤔",/r/Conservative/comments/mm6kme/atlanta_mayor_signs_executive_order_mitigating/gtpkndq/
gtpkrd0,1617816199,1,t3_mm6wk3,[removed],/r/Conservative/comments/mm6wk3/democrats_warn_that_if_hr_1_isnt_passed/gtpkrd0/
gtpku7t,1617816234,3,t3_mm6z29,"Crazy, but I thought Wray said Antifa was an ideology and fatty Nadler said it’s a myth. How could someone be charged with organizing or participating in crimes with a myth?

Could Antifa be real? Maybe my eyes haven’t been lying to me for the past year as they destroyed 100’s of millions of dollars of real property?

Pardon the sarcasm, but how long can the left pull this grift and ignore the abuses of Antifa?",/r/Conservative/comments/mm6z29/organizer_gets_busted_with_big_time_attempted/gtpku7t/
gtpkuc8,1617816236,2,t1_gtpjl74,"Yes!  Thank goodness!  Hopefully they're (staff) also signed up to attend the upcoming summer conference in Belgium on hydration science.  My God.  The number of people that are sure to die otherwise of dehydration, making the pilgrimage across the desert wastes of the State Farm Arena parking lot, with too little water on their camel trains...  

(/s)",/r/Conservative/comments/mm6kme/atlanta_mayor_signs_executive_order_mitigating/gtpkuc8/
gtpl058,1617816306,-2,t1_gtpkgrv,Do you want to discuss the article? Or are you going to continue to post troll responses?,/r/Conservative/comments/mm6g90/factcheck_colorado_makes_voting_far_easier_than/gtpl058/
gtpl2o3,1617816337,1,t3_mm6ew0,"It is all he can add, everything else he cant manage without help.",/r/Conservative/comments/mm6ew0/biden_adds_stupidity_to_his_lies_about_georgias/gtpl2o3/
gtpl4uw,1617816363,1,t3_mm6jg1,[removed],/r/Conservative/comments/mm6jg1/a_masters_mulligan_biden_says_georgia_is_now_a/gtpl4uw/
gtpl6a0,1617816379,1,t3_mm6u7q,I contributed,/r/Conservative/comments/mm6u7q/marjorie_taylor_greene_sees_32m_fundraising/gtpl6a0/
gtpl75g,1617816389,1,t1_gtphyuw,[removed],/r/Conservative/comments/mm6iw3/after_throwing_their_pastor_in_jail_for/gtpl75g/
gtpl9gn,1617816417,1,t3_mm6g90,"Tired of reporting this thread? [Donate to this charity instead](https://secure.givelively.org/donate/prevent-child-abuse-america/prevent-child-abuse-america/r-conservative). Alternatively, [join us on discord](https://discord.com/invite/conservative)

*I am a bot, and this action was performed automatically. Please [contact the moderators of this subreddit](/message/compose/?to=/r/Conservative) if you have any questions or concerns.*",/r/Conservative/comments/mm6g90/factcheck_colorado_makes_voting_far_easier_than/gtpl9gn/
gtpl9ts,1617816421,1,t3_mm6g90,[deleted],/r/Conservative/comments/mm6g90/factcheck_colorado_makes_voting_far_easier_than/gtpl9ts/
gtplcmk,1617816454,4,t1_gtpkam1,Lol yep,/r/Conservative/comments/mm6wk3/democrats_warn_that_if_hr_1_isnt_passed/gtplcmk/
gtpldri,1617816467,3,t1_gtpjrbo,"Tough shit. If you want to vote, put the effort into it. Too lazy? Then you don't vote. Wouldn't have to be a thing if there wasn't so much shady shit going on during the Presidential election night.",/r/Conservative/comments/mm6g90/factcheck_colorado_makes_voting_far_easier_than/gtpldri/
gtplj3u,1617816531,-1,t1_gtpl9gn,"I got to love how fundamentally dishonest conservatives are. Here is a good comparison between the two states getting downvoted, unlike the incredibly biased articles that got hundreds of upvotes here.",/r/Conservative/comments/mm6g90/factcheck_colorado_makes_voting_far_easier_than/gtplj3u/
gtplm7w,1617816568,3,t3_mm732h,"Now the ""infrastructure"" bill makes sense. It's going toward vacation pay, not our roads and bridges.",/r/Conservative/comments/mm732h/gillibrand_mocked_for_calling_child_care_paid/gtplm7w/
gtplrhg,1617816630,7,t3_mm73aj,"Well, looking beyond the hypocritical phrasing that annoys me to no end, i think that the current situation is opening people's eyes to the Truth of whats happening on our southern border (now that OMB has been taken out of the equation.) Talking to a leftie the other day they admitted that, prior to the current Biden Border Crisis, they didnt realize that kids HAD to be separated from their parents when the parents crossed illegally...they literally thought family separation was a *choice* that Trump implemented, not a legal mandate. So, idk, im trying to find the silver lining here, any cracks in the large wall of ignorance surrounding the vast majority of liberals is good a good thing, but it all may be too little too late.",/r/Conservative/comments/mm73aj/biden_to_tear_down_wall_replace_with_more/gtplrhg/
